product,brand,original_price,discount_rate
Women's adidas Originals Sambarose Shoes,Adidas,7999.0,40
Unisex adidas Originals Skateboarding Sabalo Shoes,Adidas,5999.0,40
Unisex adidas Originals Skateboarding Adi-Ease Shoes,Adidas,5599.0,40
Men's Sport Inspired Glarus Shoes,Adidas,2499.0,0
Men's Running Staredge Shoes,Adidas,4999.0,0
Men's Sports Inspired Lite Racer 2.0 Shoes,Adidas,4599.0,0
Men's Running Staredge Shoes,Adidas,4999.0,0
Women's adidas Running Edge Lux 3 Shoes,Adidas,7999.0,40
WOMEN'S ADIDAS SPORT INSPIRED COURTSET SHOES,Adidas,4999.0,40
Women's adidas by Stella Mccartney Running PulseBoost HD Shoes,Adidas,12999.0,40
Men's Running Equil Shoes,Adidas,4999.0,0
Women's adidas Tennis Courtsmash Shoes,Adidas,4999.0,40
Men's Running Hellion Z Shoes,Adidas,3299.0,0
Women's adidas Running Duramo 9 Shoes,Adidas,5999.0,40
Women's adidas by Stella Mccartney Running PulseBoost HD Shoes,Adidas,12999.0,40
Men's Running Thrum Shoes,Adidas,5999.0,0
Men's adidas Running Spartum Shoes,Adidas,4299.0,0
Men's adidas Running Spartum Shoes,Adidas,4299.0,0
Men's Running Spartum Shoes,Adidas,4299.0,0
Men's adidas Running Jerzo Shoes,Adidas,5299.0,0
Women's adidas Running Solar Drive 19 Shoes,Adidas,10999.0,40
Women's adidas Running Solar Drive 19 Shoes,Adidas,10999.0,40
Women's adidas Running SenseBounce+ Street Shoes,Adidas,6999.0,40
Women's adidas Running Edge Lux 3 Shoes,Adidas,7999.0,40
Men's Running Lace It Shoes,Adidas,5299.0,0
Men's adidas Running Lace It Shoes,Adidas,5299.0,0
Women's adidas Running SenseBounce+ Street Shoes,Adidas,6999.0,40
Men's Running Kalus 1.0 Shoes,Adidas,4999.0,0
Men's Sport Inspired Glarus Shoes,Adidas,2499.0,0
Women's adidas Running Solar Boost 19 Shoes,Adidas,14999.0,40
Women's adidas Sport Inspired Hoops 2.0 Shoes,Adidas,4599.0,30
Men's adidas Sport Inspired Throb Shoes,Adidas,2699.0,0
Women's adidas Running Alphabounce+ Parley Shoes,Adidas,8999.0,40
Men's Running RapidUs Shoes,Adidas,5599.0,0
Women's adidas Running Solar Blaze Shoes,Adidas,7599.0,40
Men's adidas Running Thrum Shoes,Adidas,5999.0,0
Men's adidas Sport Inspired Runigma Shoes,Adidas,5999.0,0
Women's adidas Running Edge Lux 3 Shoes,Adidas,7999.0,40
MEN'S ADIDAS ORIGINALS SKATEBOARDING SEELEY SHOES,Adidas,6999.0,0
Women's adidas Running Edge Flex Shoes,Adidas,7599.0,40
Men's adidas Originals Gazelle Low Shoes ,Adidas,7999.0,0
MEN'S ADIDAS ORIGINALS X_PLR SHOES,Adidas,7999.0,0
Women's adidas Running Edge Flex Shoes,Adidas,7599.0,40
Men's adidas Sport Inspired Kaptur Shoes,Adidas,4599.0,40
Men's adidas Running Galaxy Trail Shoes,Adidas,5999.0,60
MEN'S ADIDAS ORIGINALS GAZELLE SHOES,Adidas,7999.0,0
Women's adidas Originals SUPERSTAR CUT OUT Low Shoes ,Adidas,10999.0,60
Women's adidas ORIGINALS STAN SMITH Low Shoes ,Adidas,5999.0,0
MEN'S ADIDAS SPORT INSPIRED LITE RACER CLN SHOES,Adidas,4599.0,0
Unisex adidas Originals Superstar Shoes,Adidas,10999.0,0
Unisex Originals CRAIG GREEN KONTUUR II SHOES,Adidas,23999.0,0
Unisex adidas Swim Adissage Slides,Adidas,2299.0,0
Unisex Originals CRAIG GREEN KONTUUR II SHOES,Adidas,23999.0,0
MEN'S ADIDAS ORIGINALS CONTINENTAL 80 SHOES,Adidas,7999.0,0
Unisex adidas Originals By Alexander Wang B-Ball Soccer Shoes,Adidas,21999.0,50
Men's adidas Originals Continental 80 Shoes,Adidas,7999.0,0
Men's adidas Originals U_Path Run Shoes,Adidas,7599.0,0
Men's adidas Sport Inspired Lite Racer CLN Shoes,Adidas,4999.0,0
Unisex Originals CRAIG GREEN KONTUUR I SHOES,Adidas,23999.0,0
Kids-Unisex adidas Originals U_Path Run Shoes,Adidas,4599.0,40
Women's adidas Sport Inspired VL Court 2.0 Shoes,Adidas,4599.0,0
Women's adidas by Stella Mccartney Running UltraBoost Shoes,Adidas,17999.0,30
Men's adidas Originals Continental Superstar Shoes,Adidas,7999.0,0
Women's adidas Sport Inspired VL Court 2.0 Shoes,Adidas,4999.0,0
Men's adidas Originals X_PLR S Shoes,Adidas,7599.0,0
Women's adidas Running Edgebounce 1.5 Shoes,Adidas,8999.0,40
Men's adidas Originals Swift Run Shoes,Adidas,7599.0,0
Men's adidas Originals Superstar Shoes,Adidas,7999.0,0
Men's adidas Sport Inspired VS Pace Shoes,Adidas,3999.0,30
Women's adidas by Stella Mccartney Running UltraBoost X 3D Shoes,Adidas,17999.0,30
Women's adidas by Stella Mccartney Running PulseBoost HD Mid Shoes,Adidas,18999.0,30
Women's adidas Sport Inspired VL Court 2.0 Shoes,Adidas,4999.0,0
Women's adidas Sport Inspired VL Court 2.0 Shoes,Adidas,4599.0,0
Men's adidas Outdoor Mode Sandals ,Adidas,2499.0,40
Women's adidas by Stella Mccartney Running UltraBoost X 3D Shoes,Adidas,17999.0,30
Women's adidas Running Ultraboost 19 Shoes,Adidas,16999.0,30
Men's adidas Originals Superstar Shoes,Adidas,7999.0,0
Men's adidas Originals Superstar Laceless Shoes,Adidas,7999.0,0
Men's adidas Originals Continental 80 Shoes,Adidas,7999.0,0
Men's Originals Swift Run RF Shoes,Adidas,7599.0,0
Women's adidas Running Ultraboost 19 Shoes,Adidas,16999.0,30
MEN'S ADIDAS ORIGINALS N-5923 SHOES,Adidas,7599.0,50
Women's adidas Running PureBoost HD LTD Shoes,Adidas,13999.0,30
Women's adidas Running UltraBoost 19 Shoes,Adidas,16999.0,30
Men's adidas Running SenseBounce+ Shoes,Adidas,9999.0,40
Men's adidas Sport Inspired Grand Court Base Shoes,Adidas,4599.0,40
MEN'S ADIDAS RUNNING ENERGY CLOUD 2 SHOES,Adidas,6999.0,50
Women's adidas Running UltraBoost 19 Shoes,Adidas,16999.0,30
Unisex adidas Running Adizero RC Shoes,Adidas,7999.0,40
Women's adidas Running AlphaBoost Parley Shoes,Adidas,13999.0,30
Women's adidas Running Ultraboost 19 Shoes,Adidas,16999.0,30
MEN'S ADIDAS SPORT INSPIRED LITE RACER CLN SHOES,Adidas,4599.0,40
Unisex adidas Swim Adilette Aqua Slides,Adidas,1799.0,0
Women's adidas Running UltraBoost 19 Shoes,Adidas,16999.0,30
Women's adidas Originals Gazelle Shoes,Adidas,7999.0,50
Men's adidas Sport Inspired Zelt SL 2.0 Slip-Ons,Adidas,4799.0,50
Women's adidas Running UltraBoost 19 Shoes,Adidas,16999.0,30
WOMEN'S ADIDAS ORIGINALS FALCON SHOES,Adidas,7999.0,0
Unisex adidas Running Alphabounce+ Shoes,Adidas,9999.0,40
Women's adidas Originals Falcon Shoes,Adidas,7999.0,0
Men's adidas Sport Inspired VL Court 2.0 Shoes,Adidas,5999.0,40
UNISEX adidas Originals Pharrell Williams Hu NMD Proud Shoes,Adidas,21999.0,0
Women's adidas Originals Stan Smith Shoes,Adidas,7999.0,40
Women's adidas Originals ZX Torsion Shoes,Adidas,11999.0,0
Unisex adidas Originals Superstan Shoes,Adidas,8999.0,0
UNISEX ADIDAS ORIGINALS ADIEASE SHOES,Adidas,5599.0,50
UNISEX adidas Originals Pharrell Williams Hu NMD Proud Shoes,Adidas,21999.0,0
Unisex adidas Originals Skateboarding 3MC Shoes,Adidas,5999.0,50
Women's adidas Originals N-5923 Shoes,Adidas,7599.0,50
WOMEN'S ADIDAS SWIM EEZAY DOTS FLIP-FLOPS,Adidas,1999.0,50
Unisex adidas Originals Continental Vulc Shoes,Adidas,7599.0,30
WoMEN'S adidas RUNNING RESPONSE LITE SHOES,Adidas,9999.0,60
Women's adidas Originals Adilette Slides,Adidas,3999.0,40
Women's adidas Originals ZX Torsion Shoes,Adidas,11999.0,0
Women's adidas  edge lux Low Shoes ,Adidas,8499.0,60
Women's adidas Essentials Adilette Comfort Slides,Adidas,3299.0,40
WoMen's ADIDAS RUNNING RESPONSE SHOES,Adidas,9999.0,60
Women's adidas  RUNNING vengeful  Low Shoes ,Adidas,9999.0,60
Men's Originals Skateboarding Seeley Shoes,Adidas,5999.0,0
Women's adidas Originals POD-S3.1 Shoes,Adidas,13999.0,50
Women's adidas Swim Adilette Aqua Slides,Adidas,1799.0,0
Women's Swim Adilette Comfort Slides,Adidas,3299.0,0
Women's adidas Originals Stan Smith Shoes,Adidas,7999.0,40
Men's adidas Originals NMD_R1 Shoes,Adidas,12999.0,0
Men's adidas Originals Ninja Nite Jogger Shoes,Adidas,13999.0,0
Women's adidas Originals I-5923 Shoes,Adidas,11999.0,50
Unisex adidas Originals Skateboarding 3MC Shoes,Adidas,5999.0,40
Women's ADIDAS RUNNING ALPHABOUNCE RC SHOES,Adidas,6999.0,50
Unisex adidas Originals Skateboarding 3MC Shoes,Adidas,5999.0,0
Men's adidas Football Copa 19.3 Firm Ground Cleats,Adidas,5999.0,40
Men's adidas Football Predator 19.4 Flexible Ground Cleats,Adidas,4599.0,40
Men's adidas Football Copa 19.3 Firm Ground Cleats,Adidas,5999.0,40
Men's adidas Football Copa 19.3 Firm Ground Cleats,Adidas,5999.0,40
WOMEN'S ADIDAS SPORT INSPIRED ADVANTAGE CLEAN QT SHOES,Adidas,4599.0,50
Men's adidas Football Copa 19.4 Firm Ground Cleats,Adidas,3999.0,40
WOMEN'S ADIDAS SPORT INSPIRED ADVANTAGE CLEAN QT SHOES,Adidas,3999.0,50
Women's adidas Sport Inspired Grand Court Shoes,Adidas,5299.0,50
WOMEN'S ADIDAS SPORT INSPIRED COURT SHOES,Adidas,5599.0,50
Men's adidas Football Copa 19.4 Firm Ground Cleats,Adidas,3999.0,40
Women's adidas Sport Inspired Grand Court Shoes,Adidas,5299.0,50
Men's adidas Original X_PLR Shoes,Adidas,7599.0,50
Men's adidas Originals EQT Gazelle Shoes,Adidas,8999.0,0
Men's adidas Originals Seeley Shoes,Adidas,5999.0,40
WOMEN'S ADIDAS RUNNING SOLAR GLIDE SHOES,Adidas,10999.0,50
WOMEN'S ADIDAS SPORT INSPIRED COURT SHOES,Adidas,5599.0,50
WOMEN'S ADIDAS RUNNING EDGE LUX 2 SHOES,Adidas,7999.0,50
WOMEN'S ADIDAS RUNNING AEROBOUNCE 2 SHOES,Adidas,7999.0,50
Men's adidas Originals ZX Torsion Shoes,Adidas,13999.0,40
Men's adidas Originals Supercourt Shoes,Adidas,7599.0,0
Men's adidas Sport Inspired Questar BYD Shoes,Adidas,6999.0,40
Men's adidas Originals Supercourt Shoes,Adidas,7999.0,0
WOMEN'S ADIDAS RUNNING ALPHABOUNCE BEYOND SHOES,Adidas,8999.0,50
WOMEN'S ADIDAS RUNNING EDGEBOUNCE SHOES,Adidas,8999.0,50
WOMEN'S ADIDAS RUNNING EDGE LUX 2 SHOES,Adidas,7999.0,50
WOMEN'S ADIDAS RUNNING PUREBOOST GO SHOES,Adidas,10999.0,50
Men's adidas Running Ultraboost 19 Wood Wood Shoes,Adidas,19999.0,0
WOMEN'S ADIDAS RUNNING AEROBOUNCE 2 SHOES,Adidas,7999.0,50
Men's adidas Originals A.R. Trainers,Adidas,8999.0,0
Men's adidas Originals Rivalry Low Shoes,Adidas,7999.0,0
Men's adidas Originals SC Premiere Shoes,Adidas,11999.0,0
Men's adidas Originals X_PLR S Shoes,Adidas,7599.0,0
WOMEN'S ADIDAS RUNNING EDGEBOUNCE SHOES,Adidas,8999.0,50
Men's adidas Originals ZX 4000 4D Shoes,Adidas,27999.0,0
Women's adidas by Steall Mccartney Running Ultraboost T.S. Shoes,Adidas,17999.0,50
WOMEN'S ADIDAS RUNNING PUREBOOST GO SHOES,Adidas,10999.0,50
Women's adidas Running EdgeBounce Shoes,Adidas,8999.0,50
Men's adidas Bentton II Sandals,Adidas,2499.0,40
WOMEN'S ADIDAS RUNNING SOLAR BOOST SHOES,Adidas,11999.0,50
Men's Originals Swift Run Shoes,Adidas,7599.0,0
Women's adidas Running EdgeBounce Shoes,Adidas,8999.0,50
Men's adidas Originals X_PLR S Shoes,Adidas,7599.0,0
Women's adidas Running Alphabounce Instinct Shoes,Adidas,8999.0,50
Men's adidas Originals Continental 80 Shoes,Adidas,7999.0,0
Men's adidas Originals Swift Run Shoes,Adidas,7599.0,0
Women's adidas Sport Inspired Courtset Shoes,Adidas,4999.0,50
Men's Originals ZX Flux Shoes,Adidas,7599.0,0
Women's adidas Running Solar Drive Shoes,Adidas,9999.0,50
Women's adidas Running Solar Blaze Shoes,Adidas,7599.0,0
Men's adidas Originals Lxcon Shoes,Adidas,11999.0,0
Women's adidas Sport Inspired Court 70s Shoes,Adidas,5599.0,50
Men's adidas Originals Rivalry RM Shoes,Adidas,12999.0,0
Men's adidas Originals Team Court Shoes,Adidas,6599.0,0
Men's adidas Originals Team Court Shoes,Adidas,6599.0,0
Unisex adidas Originals Skateboarding 3MC Shoes,Adidas,5999.0,40
Women's adidas Originals Adilette Slides,Adidas,3999.0,40
Women's adidas Sport Inspired Grand Court Base Shoes,Adidas,3999.0,0
Women's adidas Sport Inspired Advantage Shoes,Adidas,5599.0,40
Unisex adidas Swim Adilette TND Slides,Adidas,2999.0,0
Men's Originals Team Court Shoes,Adidas,6599.0,0
Men's adidas Originals Drop Step Shoes,Adidas,7599.0,0
Men's adidas Originals Drop Step Shoes,Adidas,7599.0,0
Unisex adidas ORIGINALS KIEL SHOES,Adidas,6999.0,50
Men's Originals Drop Step Shoes,Adidas,7599.0,0
Men's adidas Sports Inspired Lite Racer 2.0 Shoes,Adidas,4599.0,0
Men's adidas Originals Supercourt Shoes,Adidas,7599.0,0
Women's adidas Running SenseBoost GO Shoes,Adidas,10999.0,40
Women's adidas Running Adizero Boston 8 Shoes,Adidas,10999.0,40
Women's adidas Running SenseBoost GO Shoes,Adidas,10999.0,40
Men's adidas Running Universal Works Ultraboost 19 Shoes,Adidas,19999.0,0
Men's adidas Running Universal Works Ultraboost 19 Shoes,Adidas,19999.0,0
Men's adidas Originals Superstar MG Shoes,Adidas,7999.0,0
Men's adidas Originals Supercourt Shoes,Adidas,7599.0,0
Men's adidas Running Jerzo Shoes,Adidas,5299.0,0
Men's adidas Originals Deerupt Runner Shoes,Adidas,8999.0,0
Men's Running Ancho Shoes,Adidas,4999.0,0
Men's adidas Originals Superstar MG Shoes,Adidas,7999.0,0
Men's adidas Originals Swift Run RF Shoes,Adidas,7599.0,0
MEN'S ADIDAS SPORT INSPIRED CLOUDFOAM LITE RACER SHOES,Adidas,5999.0,50
men's adidas originals NEIGHBORHOOD CHOP SHOP SHOES,Adidas,17999.0,50
Unisex adidas Originals Marathon Tech Shoes,Adidas,11999.0,50
Men's Running Ancho Shoes,Adidas,4999.0,0
Men's adidas Sport Inspired VL Court 2.0 Shoes,Adidas,4999.0,50
Men's adidas Sport Inspired Questar Flow Shoes,Adidas,6999.0,40
Men's adidas Running Solar Blaze Shoes,Adidas,7999.0,50
Men's adidas Originals White Mountaineering X Terrex Agravic Speed+ Shoes,Adidas,17999.0,50
MEN'S ADIDAS OUTDOOR NAHA SHOES,Adidas,5999.0,50
MEN'S ADIDAS RUNNING AEROBOUNCE 2 SHOES,Adidas,8999.0,50
Men's adidas Running Kalus 1.0 Shoes,Adidas,4599.0,50
Men's adidas Running PureBounce+ Street Shoes ,Adidas,7999.0,50
Men's adidas Swim Bise Slippers,Adidas,1499.0,40
Men's Running EnergyFalcon Shoes,Adidas,7599.0,0
Men's adidas Originals Rivalry Low Shoes,Adidas,7599.0,40
MEN'S ADIDAS ORIGINALS SAMBA OG SHOES,Adidas,7999.0,0
Men's adidas Running Bolter Shoes,Adidas,4299.0,50
Men's Sport Inspired PokÃ©mon Phosphere Shoes,Adidas,6999.0,0
Men's adidas Originals U_Path Run Shoes,Adidas,7999.0,0
Men's adidas Sport Inspired Kaptur Shoes,Adidas,4599.0,50
Men's adidas Running Adi Pacer 4.0 Shoes,Adidas,3599.0,50
Men's adidas Originals Skateboarding 3MC Shoes,Adidas,5999.0,40
Men's adidas Outdoor Fassar Sandals,Adidas,2799.0,40
Men's adidas Originals Superstar Shoes,Adidas,7999.0,0
Men's adidas Running 8K Shoes,Adidas,5599.0,50
Men's adidas Running Duramo 9 Shoes,Adidas,6599.0,50
MEN'S ADIDAS RUNNING GALAXY 4 SHOES,Adidas,5299.0,50
Men's adidas Running Asweerun Shoes,Adidas,5599.0,50
Men's adidas Sport Inspired Court Adapt Shoes ,Adidas,5999.0,50
Men's adidas Originals Yung-96 Chasm Shoes,Adidas,7999.0,40
Men's adidas Originals Gazelle Shoes,Adidas,7999.0,40
Men's adidas Originals Nizza Shoes,Adidas,5999.0,40
Men's adidas Originals Continental 80 Shoes,Adidas,7999.0,40
Men's adidas Originals Samba RM Shoes,Adidas,11999.0,40
MEN'S ADIDAS SPORT INSPIRED VS ADVANTAGE CLEAN SHOES,Adidas,4599.0,50
Men's Originals Samba OG Shoes,Adidas,7599.0,30
Men's adidas Originals Supercourt Shoes,Adidas,7999.0,40
Men's adidas Originals Deerupt Runner Shoes,Adidas,8999.0,40
Men's adidas Originals Rivalry Low Shoes,Adidas,7599.0,40
Women's adidas Running Pulseboost HD Winter Shoes,Adidas,12999.0,40
Men's adidas Originals Pharrell Williams X BYW CNY Shoes,Adidas,21999.0,50
Men's adidas Originals Forest Grove Shoes,Adidas,6599.0,40
Men's adidas Originals Yung-96 Chasm Shoes,Adidas,7999.0,40
Women's adidas Running PulseBoost HD Shoes,Adidas,12999.0,40
Men's adidas Originals Continental 80 Shoes,Adidas,7999.0,40
Women's adidas Adilette Comfort Slides,Adidas,3599.0,0
MEN'S ADIDAS RUNNING GALAXY 4 SHOES,Adidas,5299.0,50
Men's adidas Originals POD-S3.2 ML Shoes,Adidas,12999.0,40
WOMEN'S ADIDAS PUREBOOST X TRAINER 3.0 LL SHOES,Adidas,10999.0,50
MEN'S ADIDAS RUNNING LEGUS SHOES,Adidas,5999.0,50
WOMEN'S ADIDAS ALPHABOUNCE TRAINER SHOES,Adidas,7999.0,50
Women's adidas Running SenseBoost GO Shoes,Adidas,10999.0,40
WOMEN'S ADIDAS ALPHABOUNCE TRAINER SHOES,Adidas,7999.0,50
WoMEN'S adidas Outdoor TERREX VOYAGER DLX SHOES,Adidas,7999.0,60
Men's adidas Originals ZX Torsion Shoes,Adidas,11999.0,40
Men's adidas Originals ZX Flux Shoes,Adidas,7599.0,0
WOMEN'S ADIDAS BY STELLA MCCARTNEY PUREBOOST X TRAINING 3.0 SHOES,Adidas,12999.0,50
MEN'S ADIDAS ORIGINALS MATCHCOURT HIGH RX SHOES,Adidas,6999.0,50
Women's adidas Sport Inspired VL Court 2.0 Shoes,Adidas,4999.0,50
MEN'S ADIDAS SPORT INSPIRED CAFLAIRE SHOES,Adidas,5599.0,40
Women's adidas Outdoor Mobe Sandals,Adidas,2499.0,50
Men's adidas Sport Inspired Videll Shoes,Adidas,3799.0,50
Men's adidas Running Argecy Shoes,Adidas,5599.0,50
Women's adidas Running Ultraboost 19 Shoes,Adidas,15999.0,30
men's Adidas ORIGINALS SKATEBOARDING VARIAL SHOES,Adidas,7999.0,50
Women's adidas Sports Inspired Daily 2.0 Shoes,Adidas,4999.0,50
Men's adidas Outdoor Volantis II Shoes,Adidas,5499.0,50
Men's adidas Originals Deerupt S Shoes,Adidas,10999.0,40
Men's adidas Originals Superstar Pure Shoes,Adidas,11999.0,0
Women's adidas Running Ultraboost 19 Shoes,Adidas,15999.0,30
Men's adidas Originals ZX 4000 4D Shoes,Adidas,27999.0,0
Men's adidas Outdoor Volantis II Shoes,Adidas,5499.0,50
Women's adidas Running Ultraboost 19 Shoes,Adidas,16999.0,30
Women's adidas Originals Pharrell Williams Tennis HU Shoes,Adidas,8999.0,50
NAHA,Adidas,5999.0,50
Women's adidas Sport Inspired Questar Summer Shoes,Adidas,5599.0,50
Women's adidas Running Ultraboost 19 Shoes,Adidas,15999.0,30
Men's adidas Originals 424 Pro Model Shoes,Adidas,16999.0,0
Women's Running Asweego Shoes,Adidas,7599.0,0
Men's Originals Gazelle Shoes,Adidas,7999.0,0
Men's adidas Originals ZX 4000 4D Shoes,Adidas,27999.0,0
WoMen's adidas RUNNING KIVARO SL SHOES,Adidas,4599.0,50
Unisex ADIDAS SKATEBOARDING ADI-EASE VULCANIZED SHOES,Adidas,6999.0,50
Women's adidas PUREBOOST X ALL TERRAIN Shoes,Adidas,10999.0,60
Women's adidas Vengeful Boost Running Shoes,Adidas,10999.0,60
Men's Originals Drop Step Shoes,Adidas,7599.0,0
Women's Running CC Cosmic Boost Shoes,Adidas,9999.0,60
Unisex Football Predator Mutator 20.1 Firm Ground Boots,Adidas,14999.0,0
WOMEN'S ADIDAS SWIM CLOUDFOAM FLIP FLOPS,Adidas,3299.0,50
Men's Originals Ozweego Shoes,Adidas,11999.0,0
Women's adidas Swim Adilette Aqua Slides,Adidas,1799.0,0
Unisex adidas Originals Continental Vulc Shoes,Adidas,6599.0,40
WOMEN'S ADIDAS ELEVATE SANDALS,Adidas,2799.0,50
WOMEN'S ADIDAS TENNIS ADIZERO CLUB 2.0 SHOES,Adidas,6999.0,50
Men's adidas Originals Yung-1 Shoes,Adidas,10999.0,0
Women's ADIDAS TENNIS BARRICADE CLUB SHOES,Adidas,8999.0,50
Unisex ADIDAS RUNNING LITE RACER SHOES,Adidas,3999.0,40
Women's adidas Tennis GameCourt Shoes,Adidas,5999.0,50
Women's ADIDAS TENNIS ADIZERO CLUB SHOES,Adidas,7999.0,50
WOMEN'S ADIDAS OUTDOOR ELEVATE SANDALS,Adidas,2799.0,50
WOMEN'S ADIDAS OUTDOOR TERREX TRACEROCKER SHOES,Adidas,4999.0,40
WOMEN'S ADIDAS TENNIS ADIZERO CLUB SHOES,Adidas,5999.0,50
Women's adidas Outdoor Terrex Tracerocker Shoes,Adidas,5599.0,40
WOMEN'S ADIDAS OUTDOOR MOBE SANDALS,Adidas,2499.0,50
Women's adidas Running Asweego Shoes,Adidas,6999.0,50
Women's adidas Tennis Game Court Shoes,Adidas,5999.0,40
Women's adidas Tennis CourtJam Bounce Shoes,Adidas,8999.0,40
Women's adidas Running Ultraboost 19 Shoes,Adidas,15999.0,30
Unisex Originals CRAIG GREEN KONTUUR I SHOES,Adidas,23999.0,0
Women's adidas Tennis SoleMatch Bounce Shoes,Adidas,12999.0,40
Women's adidas Running Astrarun Shoes,Adidas,9999.0,30
Women's adidas Tennis Adizero Club Shoes,Adidas,7999.0,40
WOMEN'S ADIDAS SWIM ADILETTE COMFORT SLIDES,Adidas,2999.0,40
Unisex adidas Badminton Wucht P5.1 Shoes,Adidas,7999.0,40
Women's adidas by Stella Mccartney Running UltraBoost T Shoes,Adidas,17999.0,0
Men's adidas Running Adizero Boston 8 Shoes,Adidas,12999.0,0
Women's adidas Originals Fiorucci Adilette Slides,Adidas,4599.0,50
WoMEN'S adidas RUNNING supernova SHOES,Adidas,10999.0,60
Women's adidas by Stella Mccartney Running UltraBoost Shoes,Adidas,17999.0,0
Women's adidas Tennis GameCourt Shoes,Adidas,5999.0,30
Unisex Bascketball Pro Model 2G - Forbidden City Shoes,Adidas,9999.0,0
Women's Running Boston Shoes,Adidas,17999.0,0
Women's adidas by Stella Mccartney Running UltraBoost 20 Shoes,Adidas,17999.0,0
Women's Running SL20 Shoes ,Adidas,10999.0,0
Women's adidas Running Edge Lux 3 Shoes,Adidas,7999.0,0
Unisex Bascketball Pro Model 2G - Forbidden City + Shoes,Adidas,9999.0,0
Women's adidas Running Edge Lux 3 Shoes,Adidas,7999.0,0
Women's Sport Inspired Roguera Shoes,Adidas,4999.0,0
Women's Tennis GameCourt Shoes,Adidas,5999.0,0
Women's Running Ultraboost 20 Shoes,Adidas,16999.0,0
Women's Running Ultraboost A.RDY Shoes,Adidas,16999.0,0
Unisex adidas Originals by Alexander Wang Puff Trainer Shoes,Adidas,23999.0,0
Women's adidas Running Solar Drive 19 Shoes,Adidas,11999.0,0
Women's Running Focus Magnolia Shoes,Adidas,9999.0,0
Women's adidas Running PulseBoost HD Shoes,Adidas,14999.0,0
Women's Running SL 20 Shoes,Adidas,10999.0,0
Women's Running Ultraboost 20 Shoes,Adidas,16999.0,0
Women's Tennis Laceless Hard Court Shoes,Adidas,14999.0,0
Women's adidas Running Ultraboost 20 Shoes,Adidas,17999.0,0
Women's adidas Training FitBounce Trainers,Adidas,7599.0,0
Unisex adidas Badminton Wucht P5.1 Shoes,Adidas,7999.0,0
Women's adidas Running SenseBounce+ Shoes,Adidas,8999.0,0
Women's adidas by Stella Mccartney Running UltraBoost 20 Shoes,Adidas,17999.0,0
Women's adidas Running Ultraboost 19 Shoes,Adidas,17999.0,30
Women's adidas Running SenseBoost GO Shoes,Adidas,12999.0,0
Women's adidas Running PulseBoost HD Shoes,Adidas,14999.0,0
Women's Running Ultraboost 20 Shoes,Adidas,16999.0,0
Women's adidas Tennis Adizero Club Shoes,Adidas,6999.0,0
Women's adidas Running Adizero Boston 8 Shoes,Adidas,12999.0,0
Unisex Football Predator Mutator 20+ Firm Ground Boots,Adidas,22999.0,0
Women's adidas Running Ultraboost 19 Shoes,Adidas,15999.0,30
Women's adidas Running Ultraboost 19 Shoes,Adidas,16999.0,30
WOMEN'S ADIDAS RUNNING PUREBOUNCE+ STREET SHOES,Adidas,6999.0,50
Unisex adidas Swim Adilette Aqua Slides,Adidas,1799.0,0
Women's adidas Outdoor Mobe Sandals,Adidas,2499.0,50
Women's adidas Running Edge Lux 2 Shoes,Adidas,7999.0,50
Unisex ADIDAS OUTDOOR TERREX JAWPAW SANDALS ,Adidas,5999.0,0
Women's adidas Running Ultraboost 20 Shoes,Adidas,18999.0,0
Unisex adidas Running Pharrell Williams Solar HU Human Made Shoes,Adidas,14999.0,0
Unisex adidas Running Alphaedge 4D Shoes,Adidas,27999.0,0
Men's adidas Originals Rivalry Low Gore-Tex Shoes,Adidas,11999.0,0
Men's adidas Originals Rivalry Shoes,Adidas,8999.0,0
Men's adidas Originals 424 SC Premiere Shoes,Adidas,12999.0,0
Men's adidas Originals Supercourt RX Gore-Tex Shoes,Adidas,15999.0,0
Men's adidas Originals SC Premiere Gore-Tex Shoes,Adidas,11999.0,0
Men's adidas Swim Stabile Slippers,Adidas,1299.0,0
Men's adidas Toe Side III Slippers,Adidas,1299.0,0
Men's adidas Toe Side III Slippers,Adidas,1299.0,0
Men's adidas Swim Stabile Slippers,Adidas,1299.0,0
Men's adidas Swim Coset II Slippers,Adidas,1499.0,0
Men's adidas Originals SL 80 Shoes ,Adidas,9999.0,0
Men's adidas Swim Coset II Slippers,Adidas,1499.0,0
Men's adidas Swim Slalon Slippers,Adidas,1499.0,0
Men's adidas Originals Streetball Shoes,Adidas,10999.0,0
Men's adidas Swim Ozor 2.0 Slippers,Adidas,1299.0,0
Men's Originals ZX 750 HD Shoes,Adidas,7999.0,0
Men's adidas Originals ZX 8000 Shoes,Adidas,12999.0,0
Men's Originals ZX 750 HD Shoes,Adidas,7999.0,0
MEN'S ADIDAS RUNNING LEGUS 1.0 SHOES,Adidas,5599.0,50
MEN'S ADIDAS RUNNING ARIUS 1.0 SHOES,Adidas,4999.0,50
Men's adidas Running Kalus Shoes,Adidas,4299.0,50
men's ADIDAS ORIGINALS PW HU HOLI STAN SMITH SHOES,Adidas,9999.0,50
Men's adidas Originals ZX 8000 Shoes,Adidas,12999.0,0
Men's adidas Football Predator 19.1 Firm Ground Cleats,Adidas,14999.0,40
MEN'S ADIDAS RUNNING ERDIGA 3.0 SHOES,Adidas,4299.0,50
Men's adidas Running Kyris 4.0 Shoes,Adidas,4299.0,50
Men's adidas Running PulseBoost HD Ltd Shoes,Adidas,14999.0,30
MEN'S ADIDAS OUTDOOR BEARN SHOES,Adidas,5999.0,50
Men's adidas Sport Inspired VS Pace Shoes,Adidas,3999.0,30
MEN'S ADIDAS RUNNING ARGECY SHOES,Adidas,5599.0,50
Men's adidas Tennis Courtsmash Shoes,Adidas,5599.0,40
Men's adidas Originals Stan Smith Shoes,Adidas,7999.0,50
MEN'S ADIDAS SPORT INSPIRED LITE RACER SHOES,Adidas,3999.0,50
MEN'S ADIDAS RUNNING KIVARO 1.0 SHOES,Adidas,4599.0,50
MEN'S ADIDAS ORIGINALS CRAZY BYW LVL I SHOES,Adidas,14999.0,50
MEN'S ADIDAS RUNNING LEGUS 1.0 SHOES,Adidas,5599.0,50
MEN'S ADIDAS RUNNING RYZO 4.0 SHOES,Adidas,4599.0,50
MEN'S ADIDAS RUNNING FURIO 1.0 SHOES,Adidas,5599.0,50
Men's adidas Running Galaxy 4 Shoes,Adidas,5299.0,50
MEN'S ADIDAS ORIGINALS BOSTON SUPER X R1 SHOES,Adidas,15999.0,50
Men's adidas Originals Continental 80 Shoes,Adidas,7999.0,50
Men's s adidas Football Nemeziz 18+ Firm Ground Boots,Adidas,22999.0,50
Men's adidas Running Raddis 1.0 shoes,Adidas,5599.0,50
MEN'S ADIDAS RUNNING KIVARO 1.0 SHOES,Adidas,4599.0,50
Men's adidas RUNNING PUARO SHOES,Adidas,4999.0,60
MEN'S ADIDAS RUNNING HELKIN 3.0 SHOES,Adidas,4599.0,60
Men's adidas Sport Inspired Arcadeis Shoes,Adidas,4599.0,50
Men's adidas RunFalcon Shoes,Adidas,5999.0,40
Men's adidas Originals Continental 80 Shoes,Adidas,7999.0,50
Men's adidas Originals Deerupt Runner Shoes,Adidas,8999.0,40
Men's adidas Originals Stan Smith Shoes,Adidas,7999.0,40
Men's adidas Originals Forest Grove Shoes,Adidas,6599.0,40
Men's adidas Originals Continental 80 Shoes,Adidas,7999.0,40
Men's adidas Originals POD-S3.2 ML Shoes,Adidas,12999.0,40
Unisex adidas Originals Marathon Tech Shoes,Adidas,11999.0,40
MEN'S ADIDAS OUTDOOR SIKII SHOES,Adidas,5599.0,50
Men's adidas Sport Inspired Lite Racer Reborn Shoes,Adidas,5999.0,50
MEN'S ADIDAS ORIGINALS FUTUREPACER SHOES,Adidas,18999.0,50
Men's adidas Sport Inspired Runigma Shoes,Adidas,5999.0,0
Men's adidas Sport Inspired Glenn M Shoes,Adidas,2499.0,30
Men's adidas Originals Rivalry RM Low Shoes,Adidas,11999.0,40
Men's Sports Inspired Daily 2.0 Shoes,Adidas,4999.0,50
Men's adidas Running SenseBoost GO Shoes,Adidas,11999.0,40
Men's adidas Sports Inspired VS Pace Shoes,Adidas,3999.0,40
Men's adidas Originals Supercourt RX Shoes,Adidas,13999.0,0
Men's adidas Originals Continental 80 Shoes,Adidas,7999.0,0
Men's Originals Rivalry RM Shoes,Adidas,12999.0,0
Men's adidas Originals Streetball Shoes,Adidas,10999.0,0
Men's Running Kalus 1.0 Shoes,Adidas,4999.0,0
Men's adidas Sport Inspired VL Court 2.0 Shoes,Adidas,5999.0,40
MEN'S ADIDAS ORIGINALS SPZL ZX 452 SHOES,Adidas,9999.0,50
MEN's adidas RUNNING zeta 1.0 SHOES,Adidas,5999.0,60
