product,brand,original_price,discount_rate
Nike Baseball (MLB Seattle Mariners),Nike,65.0,10
Kentucky,Nike,24.97,10
Justin Fields Chicago Bears,Nike,175.0,0
Air Jordan 1 Elevate High SE,Nike,155.0,0
Nike Dri-FIT Game (MLB Chicago White Sox),Nike,55.0,10
Kentucky,Nike,53.97,0
Jordan x DJ Khaled,Nike,150.0,25
Nike City Connect (MLB Atlanta Braves),Nike,40.0,0
Nike,Nike,30.0,0
Netherlands,Nike,40.0,0
Nike Sportswear,Nike,19.97,0
Nike Therma City Connect Pregame (MLB Texas Rangers),Nike,85.0,0
Tottenham Club Fleece,Nike,70.0,0
Nike Dri-FIT Sideline (NFL Baltimore Ravens),Nike,55.0,0
LA Clippers City Edition,Nike,27.97,0
Nike Fashion (NFL San Francisco 49ers),Nike,35.0,0
2023 All-Star Game,Nike,55.0,0
Nike Dri-FIT Team Agility Logo Franchise (MLB Oakland Athletics),Nike,55.0,10
Nike Gym (MLB New York Yankees),Nike,80.0,10
U.S.,Nike,30.0,0
Korea 2022 Stadium Home,Nike,80.0,0
Nike Dri-FIT Sideline Victory (NFL Miami Dolphins),Nike,70.0,0
Nike Dri-FIT Sideline Team (NFL Tampa Bay Buccaneers),Nike,45.0,0
Ohio State,Nike,25.97,0
Nike Statement Ballgame (MLB New York Yankees),Nike,60.0,20
NFL Kansas City Chiefs Super Bowl LVII (Patrick Mahomes),Nike,42.0,0
Nike Spirit Gym Vintage (NFL Green Bay Packers),Nike,75.0,10
Team 31 Courtside,Nike,165.0,0
All-Star Courtside,Nike,31.97,0
Australia 2023 Stadium Home,Nike,95.0,0
Nike Athletic (NFL New York Giants),Nike,60.0,0
Houston Astros Wordmark,Nike,26.0,0
Jordan 1 Mid TD,Nike,150.0,0
Cleveland Browns Sideline,Nike,110.0,25
Jordan 1 Mid SE,Nike,80.0,0
Milwaukee Bucks,Nike,35.0,10
Nike City Connect (MLB San Francisco Giants),Nike,40.0,0
Juan Soto National League 2023 All-Star Game,Nike,195.0,0
Nike Dri-FIT Swift,Nike,110.0,0
Ohio State Icon Clash,Nike,26.97,20
Detroit Tigers Primetime Pro,Nike,32.0,0
Sophia Smith USWNT 2023 Stadium Away,Nike,130.0,0
Jordan Lil' Champ Gripper Socks (3 Pairs),Nike,12.0,0
Nike Local (NFL New Orleans Saints),Nike,35.0,0
Arizona Diamondbacks Classic99 Color Block,Nike,28.0,0
2023 All-Star Game,Nike,80.0,10
Jordan Artist Series by Parker Duncan,Nike,29.97,20
Nike Dri-FIT Travel (MLB Oakland Athletics),Nike,125.0,0
Canada Club Fleece,Nike,65.0,0
Golden State Warriors Showtime,Nike,155.0,0
Nike Velocity Team (MLB Detroit Tigers),Nike,40.0,20
Dallas Mavericks Courtside City Edition,Nike,30.97,0
Nike Dri-FIT Velocity Practice (MLB Arizona Diamondbacks),Nike,40.0,0
Nike HyperStorm,Nike,20.97,0
Boston Celtics Courtside,Nike,50.0,0
Nike Team Slogan (NFL Baltimore Ravens),Nike,45.0,0
Nike Dri-FIT Team (MLB San Diego Padres),Nike,90.0,0
Nike Therma City Connect Pregame (MLB Cincinnati Reds),Nike,85.0,10
Nike Dri-FIT Sideline Velocity (NFL Tennessee Titans),Nike,40.0,0
Nike Dri-FIT Sideline (NFL Miami Dolphins),Nike,55.0,0
Paris Saint-Germain Club Fleece,Nike,80.0,0
Nike College Club (Michigan),Nike,43.97,0
USMNT,Nike,30.0,0
Nike Dri-FIT Velocity Practice (MLB Los Angeles Dodgers),Nike,40.0,0
Nike Sportswear Storm-FIT Legacy,Nike,98.97,25
Ja Morant Grizzlies,Nike,35.0,0
Nike City Connect Dugout (MLB Chicago Cubs),Nike,220.0,20
Jordan,Nike,29.97,0
Nike Next Level (MLB Los Angeles Dodgers),Nike,70.0,25
Oregon State Beavers Bench,Nike,40.0,25
Nike Air Club Fleece,Nike,70.0,0
Nike Force 1 LV8 2,Nike,37.97,0
Nike Air Force 1 ’07 LX,Nike,84.97,0
Nike Dri-FIT Game (MLB Oakland Athletics),Nike,55.0,0
St. Louis Cardinals Americana,Nike,40.0,0
MLB Pittsburgh Pirates City Connect (Willie Stargell),Nike,160.0,10
Nike Therma Super Bowl LVII Champions Trophy (NFL Kansas City Chiefs),Nike,85.0,0
Jordan Fuel Pack,Nike,23.97,0
LeBron x Liverpool FC,Nike,95.0,0
Nike Marquee Edge,Nike,175.0,0
Nike Dri-FIT City Connect Logo (MLB Colorado Rockies),Nike,40.0,0
Indiana Pacers,Nike,70.0,20
Paris Saint-Germain 2023/24 Match Home,Nike,170.0,0
Women's adidas Originals NMD_Racer Primeknit Shoes,Adidas,14999.0,50
Women's adidas Originals Sleek Shoes,Adidas,7599.0,50
Women's adidas Swim Puka Slippers ,Adidas,999.0,40
Women's adidas Sport Inspired Questar Ride Shoes,Adidas,6999.0,50
Women's adidas Originals Taekwondo Shoes,Adidas,7999.0,50
Women's adidas Sport Inspired Duramo Lite 2.0 Shoes,Adidas,4799.0,60
Women's adidas Sport Inspired Duramo Lite 2.0 Shoes,Adidas,4799.0,50
Women's adidas Swim Puka Slippers ,Adidas,999.0,40
WOMEN'S ADIDAS RUNNING DURAMO 9 SHOES,Adidas,5599.0,50
Men's adidas Originals Forest Grove Shoes,Adidas,6599.0,40
Women's adidas Originals Swift Run Shoes,Adidas,7599.0,40
Women's adidas Originals Continental Vulc Shoes,Adidas,6599.0,40
Women's adidas Running Duramo 9 Shoes,Adidas,5999.0,50
Women's adidas Originals Supercourt Shoes,Adidas,7599.0,40
Men's adidas Sport Inspired Response Trail Shoes,Adidas,7999.0,50
Women's adidas Running Cosmic 2 Shoes,Adidas,5999.0,50
Women's adidas Sport Inspired Storm Runner Shoes,Adidas,4599.0,50
Women's adidas Sport Inspired Quickspike Shoes,Adidas,3999.0,50
WOMEN'S ADIDAS SWIM CLOUDFOAM FLIP FLOPS,Adidas,3299.0,50
Women's adidas Sport Inspired Lite Racer Shoes,Adidas,4299.0,50
Women's adidas Running Duramo 9 Shoes,Adidas,5599.0,50
Women's adidas Sport Inspired Arcadeis Shoes,Adidas,4299.0,50
Women's adidas Sport Inspired Videll Shoes,Adidas,3799.0,40
Women's adidas Running EnergyFalcon X Shoes,Adidas,6599.0,50
Women's adidas Sport Inspired Videll Shoes,Adidas,3799.0,50
Women's adidas Running Hellion Z Shoes,Adidas,3299.0,40
Women's adidas Sport Inspired Videll Shoes,Adidas,3799.0,40
Women's adidas Sport Inspired Arcadeis Shoes,Adidas,4299.0,50
Women's adidas Sport Inspired Cloudfoam Pure Shoes,Adidas,5599.0,40
Women's adidas Running Hellion Z Shoes,Adidas,3299.0,40
Women's adidas Sport Inspired Yking 2.0 Shoes,Adidas,3299.0,40
Women's adidas Running Hellion Z Shoes,Adidas,3299.0,40
Women's adidas Sport Inspired Yking 2.0 Shoes,Adidas,3299.0,40
Women's adidas Sport Inspired RunFalcon Shoes,Adidas,5599.0,40
Women's adidas Sport Inspired Quickspike Shoes,Adidas,3999.0,40
Women's adidas Sport Inspired Blaze Runner Shoes,Adidas,5599.0,40
Women's adidas Sport Inspired Lite Racer CLN Shoes,Adidas,4599.0,40
Women's adidas Sport Inspired Blaze Runner Shoes,Adidas,5599.0,40
Women's adidas Nova Run X Shoes,Adidas,8599.0,40
Women's adidas Sport Inspired Questar Flow Shoes,Adidas,6599.0,40
Women's adidas Sport Inspired Questar Flow Shoes,Adidas,6599.0,40
Women's adidas Running EnergyFalcon X Shoes,Adidas,6599.0,40
Women's adidas Running Asweego Shoes,Adidas,7599.0,40
Women's adidas Running Sooraj Shoes,Adidas,5599.0,40
Women's adidas Sport Inspired Questar Ride Shoes,Adidas,6999.0,40
Men's adidas Sport Inspired Run 70s Shoes,Adidas,5599.0,40
Women's adidas Running Asweerun Shoes,Adidas,4999.0,40
Women's adidas Sport Inspired Archivo Shoes,Adidas,4999.0,40
Women's Sport Inspired Yking 2.0 Shoes,Adidas,3299.0,40
Women's adidas Sport Inspired Archivo Shoes,Adidas,4999.0,40
Women's adidas Running Response Trail X Shoes,Adidas,6999.0,40
Women's adidas Running EnergyFalcon X Shoes,Adidas,6599.0,40
Women's adidas Originals Marathon Tech Shoes,Adidas,11999.0,40
Women's adidas Originals U_Path Run Shoes,Adidas,7999.0,40
Men's adidas Sport Inspired Drogo Shoes ,Adidas,2699.0,50
Women's adidas Originals Stan Smith Shoes,Adidas,7999.0,40
Women's adidas Running Sooraj Shoes,Adidas,5599.0,40
Women's adidas Originals U_Path Run Shoes,Adidas,7999.0,40
Men's adidas Sport Inspired Run 70s Shoes,Adidas,5599.0,40
Men's adidas Running Nayo 1.0 shoes,Adidas,4999.0,60
Men's adidas Sports Inspired Lite Racer Shoes,Adidas,4299.0,50
Men's adidas Running Nepton 2.0 Shoes,Adidas,5999.0,50
Women's adidas Running Aseerun Shoes,Adidas,4999.0,40
Men's adidas Running Torik Shoes,Adidas,4799.0,50
Men's adidas Sport Inspired Kalus 1.0 Shoes,Adidas,4599.0,50
Men's adidas Running Duramo 9 Shoes,Adidas,5999.0,40
Women's adidas Originals Continental 80 Shoes,Adidas,7999.0,40
MEN'S adidas  RUNNING YAMO 1.0 SHOES,Adidas,4799.0,50
men's ADIDAS RUNNING NEBULAR 1.0 SHOES,Adidas,4599.0,50
MEN'S ADIDAS RUNNING LEGUS SHOES,Adidas,5999.0,50
Men's adidas Originals Supercourt Shoes,Adidas,7599.0,40
Men's adidas Toe Side II Slippers,Adidas,1299.0,40
Men's adidas Outdoor Elevate Sandals,Adidas,2799.0,50
men's ADIDAS RUNNING NEBULAR 1.0 SHOES,Adidas,4599.0,50
Men's adidas Originals Superstar Shoes,Adidas,7999.0,0
Men's adidas Originals Stan Smith Shoes,Adidas,7999.0,50
Men's adidas Sport Inspired Duramo Lite 2.0 Shoes,Adidas,4999.0,50
Men's adidas Swim Ozor III Slippers,Adidas,1299.0,40
Men's adidas Swim Gadi Slippers,Adidas,1499.0,50
MEN'S ADIDAS RUNNING LEGUS SHOES,Adidas,5999.0,50
Men's adidas Originals CAMPUS Low Shoes ,Adidas,7999.0,50
MEN'S ADIDAS RUNNING HELKIN 3.0 SHOES,Adidas,4599.0,50
MEN'S ADIDAS RUNNING LEGUS 1.0 SHOES,Adidas,5599.0,50
Men's adidas Running Kollide Shoes,Adidas,4799.0,50
Men's adidas Running Edge PR Shoes,Adidas,7999.0,50
Men's adidas Originals FuturePacer Shoes,Adidas,19999.0,50
MEN'S ADIDAS ORIGINALS MICROPACER X R1 SHOES,Adidas,15999.0,50
Men's adidas Outdoor Andorian Shoes,Adidas,4599.0,50
Men's adidas Sport Inspired Advantage Base Shoes,Adidas,4999.0,50
Men's adidas Running Galaxy 4 Shoes,Adidas,5299.0,50
MEN'S ADIDAS ESSENTIALS EEZAY FLIP-FLOPS,Adidas,1999.0,50
men's ADIDAS ORIGINALS PW HU HOLI STAN SMITH SHOES,Adidas,9999.0,50
MEN'S ADIDAS RUNNING ZETA 1.0 SHOES,Adidas,5999.0,50
Men's adidas Running PureBounce+ Clima Shoes,Adidas,8999.0,50
Men's adidas Running Duramo 9 Shoes,Adidas,6599.0,50
MEN'S ADIDAS RUNNING HELKIN 3.0 SHOES,Adidas,4599.0,50
MEN'S ADIDAS RUNNING ARIUS 1.0 SHOES,Adidas,4999.0,50
Men's adidas Originals Skateboarding Seeley Shoes,Adidas,5999.0,40
MEN'S ADIDAS RUNNING HELKIN 3.0 SHOES,Adidas,4599.0,50
Men's adidas Running Grito Shoes,Adidas,4799.0,50
Men's adidas Running Nepton 2.0 Shoes,Adidas,5599.0,50
Men's adidas Running Bound Shoes,Adidas,4999.0,50
Men's adidas Outdoor Terra Light Sandals,Adidas,3599.0,40
Men's adidas Swim Gladi 19 Slippers,Adidas,1599.0,40
Men's adidas Running Torik Shoes,Adidas,4799.0,50
Men's adidas Toe Side II Slippers,Adidas,1299.0,40
Men's adidas Sport Inspired Nebular 2 Shoes,Adidas,4999.0,50
Men's adidas Running Kollide Shoes,Adidas,4799.0,50
Men's adidas Sport Inspired Netpoint Shoes,Adidas,6599.0,50
Men's adidas Running Whizz Shoes ,Adidas,5599.0,50
Women's adidas Originals Continental 80 Shoes,Adidas,8999.0,40
Men's adidas Tennis Courtsmash Shoes,Adidas,5599.0,40
Men's adidas Outdoor Terra Light Sandals,Adidas,3599.0,40
Men's adidas Running Sedna Shoes,Adidas,4299.0,50
Men's adidas Running Nepton 2.0 Shoes,Adidas,5599.0,50
Men's adidas Running PureBounce+ Street Shoes ,Adidas,7999.0,50
Women's adidas Originals Deerupt Runner Shoes,Adidas,8999.0,40
Women's adidas Originals Sleek Super Shoes,Adidas,7999.0,40
Women's adidas Originals Sleek Super Shoes,Adidas,7999.0,40
Women's adidas Originals Taekwondo Team Shoes,Adidas,6599.0,40
Men's adidas Swim Gladi 19 Slippers,Adidas,1599.0,40
Women's adidas Originals Supercourt Shoes,Adidas,7999.0,40
Women's adidas Originals Deerupt Runner Shoes ,Adidas,9999.0,50
MEN'S ADIDAS ORIGINALS BOSTON SUPER X R1 SHOES,Adidas,13999.0,50
Men's adidas Running Torik Shoes,Adidas,4799.0,50
Women's adidas Originals Sleek Shoes,Adidas,7599.0,40
Women's adidas Originals Marathon Tech Shoes,Adidas,11999.0,40
Women's adidas Sport Inspired Court 80s Shoes,Adidas,6999.0,40
Women's adidas Originals Sambarose Shoes,Adidas,7999.0,40
Women's adidas Sport Inspired Archivo Shoes,Adidas,4999.0,30
Women's adidas Originals U_Path X Shoes,Adidas,7599.0,40
Men's adidas Running Torik Shoes,Adidas,4799.0,50
Men's adidas Running Grito Shoes,Adidas,4799.0,50
Women's adidas Sport Inspired Glenn W Shoes,Adidas,2499.0,30
Women's adidas Originals Sleek Shoes,Adidas,7599.0,30
Women's adidas Originals Continental Vulc Shoes,Adidas,6599.0,40
Women's Originals Sleek Super Shoes,Adidas,7999.0,30
Women's adidas Originals Sleek Shoes,Adidas,7599.0,40
Women's adidas Originals Stan Smith Shoes,Adidas,7999.0,30
Women's adidas Originals Continental 80 Shoes,Adidas,8999.0,30
Women's adidas Originals Adilette Slides,Adidas,4999.0,40
Women's adidas Sport Inspired Glenn W Shoes,Adidas,2499.0,30
WOMEN'S ADIDAS ORIGINALS NMD_R1 STLT PRIMEKNIT SHOES,Adidas,15999.0,50
Women's adidas Originals Sleek Shoes,Adidas,7599.0,40
Women's adidas Originals N-5923 Shoes,Adidas,7599.0,50
WOMEN'S ADIDAS ORIGINALS SWIFT RUN SHOES,Adidas,7599.0,40
Women's adidas Originals Sleek Super Shoes,Adidas,7999.0,40
Women's adidas Swim Jung Slippers,Adidas,999.0,50
Women's adidas Sport Inspired Questar Flow Shoes,Adidas,6599.0,40
Women's adidas Originals Forest Grove Shoes,Adidas,6599.0,40
Women's adidas Originals Marathon Tech Shoes,Adidas,11999.0,40
Women's adidas Sport Inspired Glenn W Shoes,Adidas,2499.0,30
Women's ADIDAS ORIGINALS NMD_CS2 PK SHOES,Adidas,16999.0,50
Women's adidas Originals Sleek Shoes,Adidas,7599.0,30
Women's adidas ORIGINALS SUPERSTAR BOUNCE PK  Low Shoes ,Adidas,11999.0,60
Women's adidas Originals I-5923 Shoes,Adidas,11999.0,40
Women's adidas Originals Sambarose Shoes,Adidas,7999.0,40
WOMEN'S ADIDAS SPORT INSPIRED ENERGY CLOUD V SHOES,Adidas,5999.0,50
Women's adidas Originals Supercourt Shoes,Adidas,7999.0,40
Women's adidas Originals Falcon Shoes,Adidas,10999.0,40
Women's adidas Originals Sambarose Shoes,Adidas,7999.0,40
Women's adidas Sport Inspired Drogo Shoes,Adidas,2699.0,20
Women's adidas Running Hyperon 1.0 Shoes,Adidas,2999.0,20
Women's adidas Originals Deerupt Runner Shoes,Adidas,8999.0,40
WOMEN'S ADIDAS ORIGINALS EQT SUPPORT SOCK PRIMEKNIT SHOES,Adidas,9999.0,50
Women's adidas Originals Supercourt Shoes,Adidas,7999.0,30
Women's adidas Originals POD-S3.1 Shoes,Adidas,11999.0,40
Women's adidas Originals Stan Smith Shoes,Adidas,7999.0,40
WOMEN'S ADIDAS ORIGINALS NMD_R1 STLT PRIMEKNIT SHOES,Adidas,12999.0,50
WOMEN'S ADIDAS ORIGINALS SWIFT RUN SHOES,Adidas,7999.0,50
Women's adidas Sport Inspired Drogo Shoes,Adidas,2699.0,20
Women's adidas Originals Sambarose Zip Shoes,Adidas,8999.0,40
Men's adidas Running Rey Shoes,Adidas,4999.0,50
Women's adidas Originals Continental 80 Shoes,Adidas,7999.0,50
WOMEN'S ADIDAS ORIGINALS SAMBA OG SHOES,Adidas,7999.0,50
Men's adidas Sport Inspired Blaze Runner Shoes,Adidas,5599.0,50
Men's adidas  Sport Inspired Binafo Shoes,Adidas,5299.0,50
Men's adidas Running Rey Shoes,Adidas,4999.0,50
Men's adidas Running Zeta 1.0 Shoes,Adidas,5999.0,50
Men's adidas Running Puaro Shoes,Adidas,4999.0,50
Men's adidas Swim Stabile Slippers,Adidas,1299.0,40
Women's adidas Originals Stan Smith Shoes,Adidas,7999.0,50
Men's adidas Running Puaro Shoes,Adidas,4999.0,50
Women's adidas Running Hyperon 1.0 Shoes,Adidas,2999.0,20
Men's adidas Originals Yung-1 Shoes,Adidas,10999.0,40
Men's adidas Running Rey Shoes,Adidas,4999.0,50
Men's adidas  Sport Inspired Binafo Shoes,Adidas,5299.0,50
Women's adidas Running Hyperon 1.0 Shoes,Adidas,2999.0,20
Women's adidas Sport Inspired Drogo Shoes,Adidas,2699.0,20
Men's adidas  Sport Inspired Binafo Shoes,Adidas,5299.0,50
Men's adidas Outdoor Hoist 2019 Sandals,Adidas,2799.0,40
Women's Originals Continental 80 Shoes,Adidas,8999.0,40
Men's adidas Running Furato Shoes,Adidas,5599.0,50
Men's adidas Running Stargon 1.0 Shoes,Adidas,4599.0,50
Men's adidas Originals Skateboarding Seeley Shoes,Adidas,5999.0,40
Women's adidas Sport Inspired Lite Racer 2.0 Shoes,Adidas,3999.0,0
Men's adidas Running Raddis 1.0 shoes,Adidas,5599.0,50
Men's adidas Running Solar Drive Shoes,Adidas,9999.0,50
Men's adidas Running Weave Shoes ,Adidas,4999.0,40
Men's adidas Running Nepton 2.0 Shoes,Adidas,5599.0,50
Men's adidas Sport Inspired Lyrid Slip-ons,Adidas,4599.0,50
Men's adidas Original X_PLR Shoes,Adidas,7599.0,40
Men's adidas Running Kyris 4.0 Shoes,Adidas,4299.0,50
Men's adidas Sport Inspired Quickspike Shoes,Adidas,3999.0,50
Men's adidas Running Flank Shoes ,Adidas,5299.0,50
Men's adidas Originals ZX 4000 Shoes,Adidas,7999.0,40
Men's adidas Running Supervega Shoes,Adidas,3999.0,40
Men's adidas Sport Inspired Factor Shoes,Adidas,4299.0,50
Men's adidas Outdoor Elevate 2018 Sandals,Adidas,2799.0,50
Men's adidas Americana Low Shoes,Adidas,6599.0,40
Men's adidas Running Kalus 1.0 Shoes,Adidas,4599.0,50
Men's adidas Originals Yung-96 Shoes,Adidas,10999.0,40
Men's adidas Originals A.R. Trainers,Adidas,7999.0,40
Men's adidas Originals FYW S-97 Shoes,Adidas,12999.0,40
Men's adidas Originals Yung-96 Shoes,Adidas,7999.0,40
Men's adidas Swim Bise Slippers,Adidas,1499.0,50
Men's adidas Sport Inspired Grand Court Shoes,Adidas,6599.0,40
Men's adidas Swim Salon Slippers,Adidas,1499.0,40
Men's adidas Running Kollide Shoes,Adidas,4799.0,50
MEN'S ADIDAS OUTDOOR SIKI SHOES,Adidas,5599.0,50
Men's adidas Running Weave Shoes ,Adidas,4999.0,50
Men's adidas Running Stargon 1.0 Shoes,Adidas,4599.0,50
WOMEN'S ADIDAS SPORT INSPIRED RUN 70S SHOES,Adidas,6599.0,50
Men's adidas Sport Inspired Factor Shoes,Adidas,4299.0,50
Men's adidas Outdoor Andorian Shoes,Adidas,4599.0,50
Men's adidas Running Raddis 1.0 shoes,Adidas,5599.0,50
Women's adidas Sport Inspired Cloudfoam Pure Shoes,Adidas,5599.0,40
Men's Outdoor Ediffin II Sandals,Adidas,2999.0,0
MEN'S ADIDAS SWIM ADILETTE CLOUDFOAM PLUS LOGO SLIDES,Adidas,2999.0,0
Men's adidas Running Weave Shoes ,Adidas,4999.0,50
Men's adidas Running Stargon 1.0 Shoes,Adidas,4599.0,50
Men's adidas Sport Inspired Runigma Shoes,Adidas,5999.0,40
Women's adidas Sport Inspired QT Racer Shoes,Adidas,4599.0,40
Men's adidas Running Furato Shoes,Adidas,5599.0,50
Men's adidas Swim Ozor III Slippers,Adidas,1299.0,40
Men's adidas Sport Inspired Advantage Base Shoes,Adidas,4999.0,40
Men's adidas Outdoor Naha Shoes,Adidas,5999.0,50
Men's adidas Sport Inspired Grand Court Shoes,Adidas,6999.0,40
Men's adidas Running SenseBounce+ Street Shoes,Adidas,7999.0,50
Unisex adidas Originals Adi-Ease Shoes,Adidas,7599.0,50
Women's adidas RunFalcon Shoes,Adidas,4999.0,50
Women's adidas Sport Inspired Lite Racer RBN Shoes,Adidas,4999.0,40
Men's adidas Running Bound Shoes,Adidas,4999.0,50
Women's adidas Originals Sleek Zip Shoes,Adidas,7999.0,40
Women's adidas Originals Deerupt Runner Shoes,Adidas,9999.0,50
Women's adidas Running Cyberg 1.0 Shoes,Adidas,3599.0,40
Women's ADIDAS ORIGINALS FLB_RUNNER SHOES,Adidas,7999.0,50
Women's adidas Originals Taekwondo Team Shoes,Adidas,6599.0,40
WOMEN'S ADIDAS ORIGINALS SAMBAROSE SHOES,Adidas,7999.0,50
Women's adidas Originals Sleek Shoes,Adidas,7599.0,50
Women's adidas Originals Gazelle Shoes,Adidas,7999.0,40
Men's adidas Running Solar Blaze Shoes,Adidas,7999.0,50
Women's adidas Sport Inspired Quickspike Shoes,Adidas,3799.0,50
Women's adidas Running Cyberg 1.0 Shoes,Adidas,3599.0,40
Women's adidas Originals I-5923 Shoes,Adidas,11999.0,50
Women's adidas Originals POD-S3.1 Shoes,Adidas,13999.0,50
Women's adidas Originals Sambarose Shoes,Adidas,7999.0,50
Women's adidas Originals Sleek Shoes,Adidas,7599.0,50
Women's adidas Originals Supercourt Shoes,Adidas,7599.0,40
Women's adidas Sport Inspired Questar X BYD Shoes,Adidas,6599.0,50
Women's adidas Sport Inspired Lite Racer Shoes,Adidas,3799.0,40
WOMEN'S ADIDAS ORIGINALS I-5923 SHOES,Adidas,11999.0,50
Women's adidas Originals Rivalry Low Shoes,Adidas,7599.0,40
Men's Running Nova Flow Shoes ,Adidas,5999.0,0
Women's adidas Originals Deerupt Runner Shoes,Adidas,8999.0,40
Women's adidas Originals Sambarose Shoes,Adidas,7999.0,50
Unisex adidas Originals By Alexander Wang Wangbody Run Shoes,Adidas,17999.0,50
Men's adidas Toe Side II Slippers,Adidas,1299.0,40
WOMEN'S ADIDAS ORIGINALS ARKYN PRIMEKNIT SHOES,Adidas,11999.0,50
Women's adidas Swim Ozor III Slippers,Adidas,1299.0,40
Women's adidas Swimming Eezay 2019 Slippers,Adidas,1499.0,50
Men's adidas Running Kollide Shoes,Adidas,4799.0,50
Women's adidas Sport Inspired Lite Racer Slip-Ons,Adidas,3999.0,40
Women's adidas Sport Inspired Chaos Shoes,Adidas,6599.0,40
Men's Running Nova Flow Shoes ,Adidas,5999.0,0
Women's adidas Swim Eezay Slippers,Adidas,1299.0,50
Women's adidas Originals POD-S3.1 Shoes,Adidas,13999.0,50
Women's adidas Originals Superstar Shoes,Adidas,7999.0,0
Women's adidas Originals I-5923 Shoes ,Adidas,11999.0,40
Women's adidas ORIGINALS EQT RACING  Low Shoes ,Adidas,9999.0,60
Unisex adidas Originals Skateboarding 3MC Shoes,Adidas,5999.0,50
Women's adidas Originals Supercourt Shoes,Adidas,7999.0,40
Women's adidas Sport Inspired Kaptir X Shoes,Adidas,7599.0,40
Women's adidas Originals Continental 80 Shoes,Adidas,7999.0,40
Women's adidas Originals Sambarose Shoes,Adidas,7999.0,0
Women's adidas Originals I-5923 Shoes,Adidas,11999.0,40
WOMEN'S ADIDAS ORIGINALS EQT ADV RACING SHOES,Adidas,9999.0,50
Women's adidas Sport Inspired Yatra Shoes,Adidas,4299.0,40
Unisex adidas Originals Adi-Ease Shoes,Adidas,5999.0,50
Men's Running Nova Flow Shoes ,Adidas,5999.0,0
Women's adidas Originals Tubular Shadow Shoes,Adidas,7999.0,50
Women's adidas Originals I-5923 Shoes,Adidas,11999.0,40
Unisex adidas Originals By Alexander Wang Wangbody Run Shoes,Adidas,17999.0,40
Women's adidas Running Asweego Shoes,Adidas,6999.0,50
Women's adidas Sport Inspired RunFalcon Shoes,Adidas,5599.0,40
Women's adidas Originals Forest Grove Shoes,Adidas,6599.0,40
MEN'S ADIDAS RUNNING ARGECY SHOES,Adidas,5599.0,50
WOMEN'S ADIDAS ORIGINALS GAZELLE SHOES,Adidas,7999.0,50
Men's adidas Running Erdiga 3.0 Shoes,Adidas,4299.0,50
Men's adidas Running Duramo 9 Shoes,Adidas,6599.0,50
Men's adidas Sport Inspired Nebular 2 Shoes,Adidas,4999.0,50
Men's adidas Sport Inspired Binafo Shoes,Adidas,5299.0,50
Men's adidas Sport Inspired Blaze Runner Shoes,Adidas,5599.0,50
Women's adidas Originals Arkyn Shoes,Adidas,11999.0,50
Women's adidas Originals Deerupt Runner Shoes,Adidas,9999.0,50
Men's adidas Running 90s Valasion Shoes,Adidas,8999.0,50
Men's adidas Sport Inspired Zeta 2.0 Shoes,Adidas,4599.0,50
MEN'S ADIDAS RUNNING PUARO SHOES,Adidas,4999.0,50
Men's adidas Running Helkin 3 Shoes,Adidas,4599.0,50
Men's adidas Running Helkin 3 Shoes,Adidas,4599.0,50
Men's adidas Running Erdiga 4.0 Shoes,Adidas,4999.0,50
Men's adidas Running Kylen 1.0 shoes,Adidas,4999.0,50
Men's adidas Running Galaxy 4 Shoes,Adidas,5999.0,50
Men's adidas Running Flank Shoes ,Adidas,5299.0,50
Men's adidas Running Helkin 3 Shoes,Adidas,4599.0,50
Men's adidas Sport Inspired Phanko Shoes,Adidas,5599.0,50
Unisex adidas Originals Marathon Tech Shoes,Adidas,12999.0,40
Men's adidas Sport Inspired Binafo Shoes,Adidas,5299.0,50
Men's adidas Sport Inspired Archivo Shoes,Adidas,5599.0,40
Men's adidas Sport Inspired Archivo Shoes,Adidas,5599.0,50
MEN'S ADIDAS RUNNING ARIUS 1.0 SHOES,Adidas,4999.0,50
Men's adidas Running Bound Shoes,Adidas,4999.0,50
Men's adidas Running Rush Shoes,Adidas,3599.0,50
Men's adidas Running Duramo 9 Shoes,Adidas,5999.0,50
Men's adidas Sport Inspired Blaze Runner Shoes,Adidas,5599.0,50
Men's adidas Running Dracon Shoes,Adidas,3999.0,50
Men's adidas Running Helkin 3 Shoes,Adidas,4599.0,50
men's ADIDAS RUNNING NAYO 1.0 SHOES,Adidas,4999.0,50
MEN'S ADIDAS RUNNING NAYO 2.0 SHOES,Adidas,5299.0,50
Men's adidas Running Zeta 1.0 Shoes,Adidas,5999.0,50
men's ADIDAS RUNNING NAYO 1.0 SHOES,Adidas,4999.0,50
Men's adidas Running Zeta 1.0 Shoes,Adidas,5999.0,50
men's Adidas RUNNING TORIL SHOES,Adidas,4999.0,50
Men's adidas Running Asweerun Shoes,Adidas,5599.0,50
MEN'S ADIDAS RUNNING NAYO 2.0 SHOES,Adidas,5299.0,50
Men's adidas Sport Inspired Factor Shoes,Adidas,4299.0,50
Men's adidas Sport Inspired Quickspike Shoes,Adidas,3999.0,50
Men's adidas Sport Inspired Quickspike Shoes,Adidas,3999.0,50
Men's adidas Sport Inspired Phanko Shoes,Adidas,5599.0,50
Men's adidas Sport Inspired Stunn Shoes,Adidas,5599.0,50
Men's adidas Running Flank Shoes ,Adidas,5299.0,50
men's ADIDAS RUNNING TORIL 1.0 SHOES,Adidas,4999.0,50
Men's adidas Sport Inspired Quickspike Shoes,Adidas,3999.0,50
Men's adidas Running Nepton 2.0 Shoes,Adidas,5599.0,50
MEN'S ADIDAS RUNNING KIVARO 1.0 SHOES,Adidas,4599.0,50
MEN'S ADIDAS RUNNING ERDIGA 4.0 SHOES,Adidas,4599.0,50
Men's adidas Running Kyris 1.0 Shoes,Adidas,4599.0,50
Men's adidas Sport Inspired Blaze Runner Shoes,Adidas,5599.0,50
Unisex adidas Originals Skateboarding 3MC Shoes,Adidas,5999.0,40
Men's adidas Sport Inspired Duramo Lite 2.0 Shoes,Adidas,4999.0,50
Men's adidas Sport Inspired Blaze Runner Shoes,Adidas,5599.0,50
Unisex adidas Originals Marathon Tech Shoes,Adidas,11999.0,40
Women's adidas Originals Marathon Tech Shoes,Adidas,11999.0,40
Men's adidas Running Raddis 1.0 shoes,Adidas,5599.0,50
Women's adidas Originals Sleek Super Shoes,Adidas,7999.0,40
Women's adidas Originals Supercourt Shoes,Adidas,7599.0,40
Men's adidas Running Flank Shoes ,Adidas,5299.0,50
Women's adidas Originals Falcon Shoes,Adidas,8999.0,40
Men's adidas Sport Inspired Arcadeis Shoes,Adidas,4599.0,50
Men's adidas Running Puaro Shoes,Adidas,4999.0,50
Unisex adidas Originals Skateboarding Adi-Ease Shoes,Adidas,5599.0,40
Men's adidas Sport Inspired Factor Shoes,Adidas,4299.0,50
MEN'S ADIDAS RUNNING LEGUS SHOES,Adidas,5999.0,50
Women's adidas Originals Forest Grove Shoes,Adidas,6599.0,40
Men's adidas Sport Inspired Nebular 2 Shoes,Adidas,4999.0,50
Women's adidas Originals U_Path X Shoes,Adidas,7599.0,40
Women's adidas Originals Continental 80 Strap Shoes,Adidas,7999.0,40
WOMEN'S ADIDAS RUNNING QUESA SHOES,Adidas,6999.0,50
WOMEN'S ADIDAS SPORT INSPIRED RUN 70S SHOES,Adidas,6599.0,60
Men's adidas Running Whizz Shoes ,Adidas,5599.0,50
Women's adidas Originals U_Path X Shoes,Adidas,7599.0,40
Women's adidas Running Bolter Shoes,Adidas,4299.0,50
Women's adidas Sports Inspired Court Adapt Shoes,Adidas,5299.0,50
Women's adidas Running Duramo SL Shoes,Adidas,5599.0,0
Women's adidas Originals NMD_R1 Shoes,Adidas,12999.0,40
Men's adidas Sport Inspired Kaptur Shoes,Adidas,4599.0,50
WOMEN'S ADIDAS RUNNING ASWEERUN SHOES,Adidas,4999.0,0
Women's adidas Originals Falcon Shoes,Adidas,7999.0,40
Women's adidas Sport Inspired VS Advantage Clean Shoes,Adidas,4599.0,50
Women's adidas Running Sooraj Shoes,Adidas,5599.0,0
Unisex adidas Originals Skateboarding 3MC Shoes,Adidas,5999.0,40
Women's adidas Sport Inspired Duramo Lite 2.0 Shoes,Adidas,4799.0,50
Men's adidas Running Duramo 9 Shoes,Adidas,5999.0,50
Women's adidas Originals Adilette Zip Slides,Adidas,4999.0,50
