product,brand,original_price,discount_rate
Men's adidas Sport Inspired Duramo Lite 2.0 Shoes,Adidas,4999.0,50
Men's adidas Football Copa 19+ Firm Ground Cleats,Adidas,22999.0,40
Men's adidas Sport Inspired Questar Drive Shoes,Adidas,6999.0,50
MEN'S ADIDAS SPORT INSPIRED CLOUDFOAM LITE RACER SHOES,Adidas,5999.0,50
Men's adidas Running Kalus 1.0 Shoes,Adidas,4999.0,0
Men's adidas Running Duramo 9 Shoes,Adidas,5999.0,50
Men's adidas Originals Crazy BYW X 2.0 Shoes,Adidas,14999.0,40
Men's adidas Running Kalus Shoes,Adidas,4299.0,50
Men's adidas Running Hellion Z Shoes ,Adidas,3299.0,50
Men's adidas Running Grito Shoes,Adidas,3999.0,50
Men's adidas Originals STAN SMITH Low Shoes ,Adidas,7599.0,30
Men's adidas Sport Inspired Zeta 2.0 Shoes,Adidas,4599.0,50
Men's adidas Football Predator 19.4 Flexible Ground Cleats,Adidas,4599.0,40
Men's adidas Swim Gadi Slippers,Adidas,1499.0,50
men's ADIDAS RUNNING LEGUS 1 SHOES,Adidas,5599.0,60
Men's adidas RUNNING NAYO SHOES ,Adidas,4599.0,60
Men's adidas Originals Spezial Handball Shoes,Adidas,7999.0,40
Men's adidas Originals Supercourt Shoes,Adidas,7599.0,40
men's ADIDAS ORIGINALS X_PLR SHOES,Adidas,7999.0,0
Men's Originals Samba OG Shoes,Adidas,7599.0,0
Men's adidas Tennis Courtsmash Shoes,Adidas,5599.0,0
Men's adidas Running Sedna Shoes,Adidas,4299.0,50
Men's adidas Sport Inspired Advantage Shoes,Adidas,5999.0,0
Men's adidas Originals Gazelle Shoes,Adidas,7999.0,50
Men's adidas Sport Inspired Grand Court Base Shoes,Adidas,4599.0,0
Men's adidas Sport Inspired Grand Court Base Shoes,Adidas,4599.0,0
Men's adidas Sport Inspired Grand Court Base Shoes,Adidas,4599.0,0
Men's adidas Sport Inspired Advantage Base Shoes,Adidas,4999.0,0
Men's adidas Sport Inspired Advantage Base Shoes,Adidas,4999.0,0
Men's adidas Sports Inspired Hoops 2.0 Mid Shoes,Adidas,6599.0,40
Men's adidas Sport Inspired Advantage Base Shoes,Adidas,4999.0,0
Men's adidas Sports Inspired Hoops 2.0  Shoes,Adidas,4999.0,40
Men's adidas Sport Inspired Grand Court Base Shoes,Adidas,4599.0,0
Men's adidas Originals 3ST.004 Shoes,Adidas,10999.0,40
Men's adidas Originals Gazelle Shoes,Adidas,7999.0,40
Men's adidas Originals A.R. Trainers,Adidas,7999.0,40
Men's adidas RunFalcon Shoes,Adidas,5999.0,40
Men's adidas Originals Liberty Cup Shoes,Adidas,7599.0,40
Men's adidas Sport Inspired Grand Court Shoes,Adidas,6599.0,0
Men's adidas Originals Tyshawn Shoes,Adidas,7599.0,40
Men's adidas Sport Inspired Fusion Flow Shoes,Adidas,5999.0,40
Men's Sport Inspired Grand Court Shoes,Adidas,6599.0,0
Men's adidas Outdoor Ediffin II Sandals,Adidas,2999.0,0
Men's adidas Basketball RunTheGame Shoes,Adidas,7999.0,40
Men's adidas Originals Superstar Laceless Shoes,Adidas,7999.0,0
Men's adidas Outdoor Gladi 2.0 Sandals,Adidas,2799.0,0
Men's adidas Outdoor Spry II Sandals,Adidas,2799.0,0
Men's Outdoor Elevate Sandals,Adidas,2799.0,0
Men's adidas Outdoor Spry II Sandals,Adidas,2799.0,0
Men's adidas Outdoor Adipu Sandals,Adidas,2999.0,0
Men's adidas Outdoor Spry II Sandals,Adidas,2799.0,0
Men's Outdoor Adipu Sandals,Adidas,2999.0,0
Men's Outdoor Hoist Light Sandals,Adidas,2999.0,0
Men's adidas Outdoor Elevate Sandals,Adidas,2799.0,0
Men's adidas Originals Swift Run Shoes,Adidas,7999.0,0
MEN'S ADIDAS RUNNING NEBULAR 2.0 SHOES,Adidas,4999.0,50
Men's adidas Outdoor Echo Sandals,Adidas,2799.0,0
Men's adidas Running Lace It Shoes,Adidas,5299.0,40
Men's adidas Originals NMD_R1 Shoes,Adidas,12999.0,40
Men's adidas Outdoor Terra Light Sandals,Adidas,3599.0,40
Men's adidas Running Solar Blaze Shoes,Adidas,7999.0,0
Men's adidas Outdoor Hoist 2019 Sandals,Adidas,2799.0,40
Men's adidas Running Victriox Shoes,Adidas,3999.0,20
Men's adidas Sport Inspired Questar BYD Shoes,Adidas,7999.0,50
Men's adidas Sport Inspired Glarus Shoes,Adidas,2499.0,0
Men's adidas Originals White Mountaineering Nite Jogger Shoes,Adidas,14999.0,0
Men's adidas Originals Superstar Pure Shoes,Adidas,11999.0,0
Men's adidas Originals ZX Torsion Shoes,Adidas,11999.0,0
Men's adidas Originals Yung-1 Shoes,Adidas,10999.0,0
Men's adidas Originals Supercourt Shoes,Adidas,7599.0,40
Men's adidas Swim Coset II Slippers,Adidas,1499.0,40
Men's adidas Originals U_Path Run Shoes,Adidas,7999.0,0
Men's adidas Nemeziz 19.4 Flexible Ground Cleats,Adidas,4599.0,40
Men's adidas Running Ultraboost 19 Wood Wood Shoes,Adidas,19999.0,0
MEN'S ADIDAS RUNNING COSMIC 2 SHOES,Adidas,6999.0,50
MEN'S adidas  RUNNING YAMO 1.0 SHOES,Adidas,4799.0,50
men's ADIDAS RUNNING LEGUS SHOES,Adidas,5999.0,60
men's ADIDAS RUNNING CF ELEmen'sT RACE SHOES,Adidas,5599.0,50
Men's adidas Originals FYW S-97 Shoes,Adidas,12999.0,50
MEN'S ADIDAS SPORT INSPIRED QUESTAR RIDE SHOES,Adidas,7999.0,50
Men's adidas Sport Inspired Duramo Lite 2.0 Shoes,Adidas,4999.0,50
men's ADIDAS RUNNING TYLO SHOES,Adidas,5599.0,50
Men's adidas Essentials Eezay Flip-Flops,Adidas,1999.0,50
Men's adidas Running AeroBounce 2 Shoes,Adidas,7999.0,50
Men's adidas Running Whizz Shoes ,Adidas,5599.0,50
Men's adidas Running Asweego Shoes,Adidas,7999.0,50
Men's adidas Sport Inspired Blaze Runner Shoes,Adidas,5599.0,50
Men's adidas Running Dracon Shoes,Adidas,3999.0,50
Men's adidas Running Puaro Shoes,Adidas,4999.0,50
Men's adidas Originals Crazy BYW LVL X Pharrell Williams Shoes,Adidas,21999.0,50
Men's adidas Running Galaxy 4 Shoes,Adidas,5999.0,50
MEN'S ADIDAS ORIGINALS RISING STAR X R1 SHOES,Adidas,15999.0,50
Men's adidas Running Asweerun Shoes,Adidas,5599.0,50
Men's adidas Sport Inspired Arcadeis Shoes,Adidas,4599.0,50
Men's adidas Originals Supercourt Shoes,Adidas,7599.0,40
Men's adidas Originals Sobakov P94 Shoes,Adidas,7599.0,40
Men's adidas Originals Crazy BYW BF Shoes,Adidas,19999.0,0
Men's adidas Originals Superstar Clean Shoes,Adidas,10999.0,0
Men's ADIDAS ORIGINALS N-5923 SHOES,Adidas,7999.0,50
Men's adidas Running Kivaro 1 shoes,Adidas,4599.0,50
Men's adidas Originals Samba OG MS Shoes,Adidas,7999.0,50
MEN'S ADIDAS SPORT INSPIRED RUN 80S SHOES,Adidas,7999.0,50
Men's adidas Originals Forest Grove Shoes,Adidas,6999.0,50
Men's adidas Sport Inspired Cloudfoam Racer TR Shoes,Adidas,5999.0,50
MEN'S ADIDAS RUNNING ARIUS 1.0 SHOES,Adidas,4999.0,50
Men's adidas Sport Inspired Lite Racer Clean Shoes,Adidas,4599.0,50
MEN'S ADIDAS ORIGINALS MUNCHEN SUPER SPZL SHOES,Adidas,9999.0,50
Men's adidas Running Rush Shoes,Adidas,3599.0,50
Men's adidas Sport Inspired Blaze Runner Shoes,Adidas,5599.0,50
Men's adidas Sport Inspired Strikerr,Adidas,4599.0,40
Men's adidas Running Furato Shoes,Adidas,5599.0,50
MEN'S ADIDAS RUNNING DURAMO 9 SHOES,Adidas,6599.0,50
Men's adidas Originals Sobakov P94 Shoes,Adidas,7599.0,40
MEN'S ADIDAS CLOUDFOAM RACER TR SHOES,Adidas,5999.0,50
men's adidas RUNNING LEGUS SHOES,Adidas,5599.0,50
MEN'S ADIDAS RUNNING ADISTARK 3.0 SHOES,Adidas,3999.0,50
MEN'S ADIDAS ORIGINALS SWIFT RUN SHOES,Adidas,7599.0,50
Men's adidas Running Solar Glide Shoes ,Adidas,12999.0,50
Men's adidas Running Rush Shoes,Adidas,3599.0,50
Men's adidas Originals Marathon Tech Shoes,Adidas,11999.0,50
Women's adidas Outdoor Elevate 2018 Sandals,Adidas,2799.0,40
Men's adidas Originals Gazelle Shoes,Adidas,7999.0,40
Men's adidas RUNNING YAMO 1.0 SHOES,Adidas,4799.0,50
men's ADIDAS ORIGINALS N-5923 RUNNER CLS SHOES,Adidas,7999.0,50
men's ADIDAS ORIGINALS SWIFT RUN PK SHOES,Adidas,10999.0,50
MEN'S ADIDAS ORIGINALS GAZELLE SHOES,Adidas,7999.0,50
MEN'S ADIDAS RUNNING COSMIC 2 SHOES,Adidas,6999.0,50
men's ADIDAS RUNNING TORIL 1.0 SHOES,Adidas,4999.0,50
MEN'S ADIDAS ORIGINALS SWIFT RUN SHOES,Adidas,7999.0,0
MEN'S ADIDAS RUNNING LEGUS SHOES,Adidas,5999.0,50
MEN'S ADIDAS RUNNING FLUIDCLOUD NEUTRAL SHOES,Adidas,5999.0,50
MEN'S ADIDAS RUNNING KALUS SHOES,Adidas,4299.0,50
MEN'S ADIDAS SPORT INSPIRED RUN 80S SHOES,Adidas,7999.0,50
MEN'S ADIDAS SPORT INSPIRED QUESTAR DRIVE SHOES,Adidas,6999.0,50
MEN'S ADIDAS RUNNING NAYO 2.0 SHOES,Adidas,5299.0,50
Men's adidas Sport Inspired Cloudfoam Racer TR Shoes,Adidas,5999.0,50
Men's adidas Running Energy Cloud 2 Shoes,Adidas,6999.0,50
MEN'S ADIDAS RUNNING NEBULAR 2.0 SHOES,Adidas,4999.0,50
Men's adidas Originals Rivalry Low Shoes,Adidas,7599.0,0
Men's adidas Originals N-5923 Shoes,Adidas,7599.0,50
Men's adidas Originals FuturePacer Shoes,Adidas,19999.0,50
Men's adidas Running Erish Shoes,Adidas,4299.0,50
Men's adidas Originals Yung-1 Shoes,Adidas,10999.0,0
Men's adidas Originals U_Path Run Shoes,Adidas,7999.0,0
Men's adidas Sport Inspired Videll Shoes,Adidas,3799.0,50
MEN'S ADIDAS ORIGINALS EQT_ZX SHOES,Adidas,15999.0,50
Men's adidas Outdoor Elevate 2018 Sandals,Adidas,2799.0,50
Men's adidas Sport Inspired Cloudfoam Ultimate Shoes,Adidas,7999.0,50
men's ADIDAS RUNNING HELKIN 3 SHOES,Adidas,4299.0,50
men's ADIDAS RUNNING ERDIGA 3 SHOES,Adidas,4299.0,50
MEN'S ADIDAS OUTDOOR TERREX CMTK SHOES,Adidas,4999.0,50
MEN'S ADIDAS RUNNING DURAMO 9 SHOES,Adidas,5999.0,50
MEN'S ADIDAS ORIGINALS MUNCHEN SUPER SPZL SHOES,Adidas,9999.0,50
MEN'S ADIDAS ORIGINALS MICROPACER X R1 SHOES,Adidas,15999.0,50
MEN'S ADIDAS RUNNING NEBULAR 2.0 SHOES,Adidas,4999.0,50
Men's adidas Originals Crazy BYW Icon 98 Shoes,Adidas,15999.0,40
Men's adidas Originals Yung-96 Shoes,Adidas,7999.0,40
Men's adidas Outdoor Terrex CMTK Shoes,Adidas,4999.0,50
Men's adidas Originals Nite Jogger Shoes,Adidas,12999.0,40
Men's adidas Outdoor Naha Shoes,Adidas,5999.0,50
Men's adidas Outdoor Terrex CMTK Shoes,Adidas,4999.0,50
Men's adidas Outdoor Geocach II Shoes,Adidas,4999.0,50
Men's adidas Running Solar Boost 19 Shoes,Adidas,15999.0,40
Kids-Unisex Running RapidaRun Knit EL Shoes,Adidas,4999.0,40
Men's adidas Originals POD-S3.2 ML Shoes,Adidas,12999.0,40
Men's Sports Inspired Hoops 2.0 Mid Shoes,Adidas,6599.0,30
Men's adidas Outdoor Argo Trek 19 Shoes,Adidas,3999.0,30
Men's Running Equil Shoes,Adidas,4999.0,0
Men's adidas Sport Inspired VL Court 2.0 Shoes,Adidas,4999.0,0
men's ADIDAS ORIGINALS PW HU HOLI STAN SMITH SHOES,Adidas,9999.0,50
MEN'S ADIDAS ORIGINALS X_PLR SHOES,Adidas,7999.0,50
MEN'S ADIDAS ORIGINALS BOSTON SUPER X R1 SHOES,Adidas,15999.0,50
MEN'S ADIDAS ORIGINALS ZX930 X EQT SHOES,Adidas,15999.0,50
men's ADIDAS SKATEBOARDING SEELEY VULCANIZED SHOES,Adidas,7999.0,50
Men's adidas Sports Inspired VS Pace Shoes,Adidas,3999.0,0
Men's adidas Running Solar Drive 19 Shoes,Adidas,11999.0,30
Men's adidas Football X 19.4 Flexible Ground Cleats,Adidas,4599.0,0
MEN'S ADIDAS ORIGINALS I-5923 SHOES,Adidas,11999.0,50
Men's adidas Running Solarboost 19 Shoes,Adidas,15999.0,0
Men's adidas RUNNING FLUIDCLOUD NEUTRAL SHOES,Adidas,5999.0,50
MEN'S ADIDAS SPORT INSPIRED QUESTAR DRIVE SHOES,Adidas,6999.0,50
Men's adidas Football Nemeziz 19.3 Turf Boots,Adidas,5999.0,0
MEN'S ADIDAS RUNNING ASWEERUN SHOES,Adidas,5599.0,50
MEN'S ADIDAS ORIGINALS GAZELLE SHOES,Adidas,7999.0,50
MEN'S ADIDAS ORIGINALS N-5923 SHOES,Adidas,7599.0,50
men's ADIDAS ORIGINALS CAMPUS STITCH AND TURN SHOES,Adidas,8999.0,60
Men's adidas Originals Forest Grove Shoes,Adidas,6999.0,50
Men's adidas Sport Inspired Lite Racer CLN Shoes ,Adidas,4599.0,50
Men's adidas RunFalcon Shoes,Adidas,5999.0,50
Men's adidas Running Hyperon 1.0 Shoes,Adidas,2999.0,50
Men's adidas Sport Inspired Heawin Shoes,Adidas,4999.0,50
Men's adidas Originals Pusha T Ozweego Shoes,Adidas,13999.0,0
Men's adidas Originals Samba OG Shoes,Adidas,8999.0,40
MEN'S adidas ORIGINALS GT WENSLEY SPZL SHOES,Adidas,11999.0,60
MEN'S ADIDAS RUNNING DURAMO 9 SHOES,Adidas,6599.0,50
Men's adidas Sport Inspired Kaptir Shoes,Adidas,7999.0,50
MEN'S ADIDAS RUNNING GALAXY 4 SHOES,Adidas,5299.0,50
men's ADIDAS RUNNING SOLYX SHOES,Adidas,7999.0,50
Men's adidas Running Galaxy 4 Shoes,Adidas,5299.0,50
men's ADIDAS RUNNING RAZEN SHOES,Adidas,5299.0,50
men's Adidas RUNNING LEGUS SHOES,Adidas,5599.0,50
MEN'S ADIDAS SPORT INSPIRED QUESTAR RIDE SHOES,Adidas,7999.0,50
Men's adidas Original X_PLR Shoes,Adidas,7599.0,40
Men's adidas Originals SUPERSTAR 80S DECON Low Shoes ,Adidas,12999.0,60
Men's adidas Sport Inspired Lite Racer Clean Shoes,Adidas,4599.0,50
MEN'S ADIDAS RUNNING KYLEN 1.0 SHOES,Adidas,4999.0,50
MEN'S ADIDAS RUNNING GALAXY 4 SHOES,Adidas,5299.0,50
Men's adidas Sport Inspired Questar Flow Shoes,Adidas,6999.0,50
MEN'S ADIDAS RUNNING NEPTON 1.0 SHOES,Adidas,4999.0,50
MEN'S ADIDAS RUNNING KYLEN 1.0 SHOES,Adidas,4999.0,50
MEN'S ADIDAS RUNNING ERDIGA 3.0 SHOES,Adidas,4299.0,50
MEN'S ADIDAS RUNNING NEPTON 1.0 SHOES,Adidas,4999.0,50
MEN'S ADIDAS RUNNING ASWEEGO SHOES,Adidas,7999.0,50
Men's adidas Originals Samba RM Shoes,Adidas,11999.0,40
MEN'S ADIDAS RUNNING FURIO 1.0 SHOES,Adidas,5599.0,50
Men's adidas Running Rush Shoes,Adidas,3599.0,50
Men's adidas Running Fluo Shoes,Adidas,3799.0,50
Men's adidas Running Kyris 1.0 Shoes,Adidas,4599.0,50
Men's adidas Running Stargon 1.0 Shoes,Adidas,4299.0,50
Men's adidas Sport Inspired Zeta 2.0 Shoes,Adidas,4599.0,50
Men's adidas Sport Inspired Fassar Shoes,Adidas,3999.0,50
Men's adidas Sport Inspired Fassar Shoes,Adidas,3999.0,50
Men's adidas Outdoor Echo Sandals,Adidas,2799.0,40
Men's adidas Originals CountryxKamanda Shoes,Adidas,11999.0,40
Men's adidas Running Furio Lite 1.0 Shoes,Adidas,3599.0,50
Men's adidas RUNNING NAYO SHOES,Adidas,4599.0,60
MEN'S adidas RUNNING nayo 1.0 SHOES,Adidas,4999.0,60
Men's adidas Originals Stan Smith Shoes,Adidas,10999.0,0
MEN's adidas RUNNING Stardrift SHOES,Adidas,4999.0,60
MEN's adidas RUNNING toril SHOES,Adidas,4599.0,60
MEN'S ADIDAS ORIGINALS FUTUREPACER SHOES,Adidas,18999.0,50
MEN'S ADIDAS ORIGINALS N-5923 SHOES,Adidas,7599.0,50
Men's adidas Originals Tubular Dusk Shoes,Adidas,7999.0,50
Men's adidas Originals Samba OG Shoes,Adidas,7999.0,50
Men's adidas Originals A.R. Trainer Shoes,Adidas,8999.0,50
Men's adidas  RUNNING Stardrift Low Shoes ,Adidas,4999.0,60
MEN'S ADIDAS RUNNING AEROBOUNCE 2 SHOES,Adidas,8999.0,50
Men's adidas Originals Pusha T Ozweego Shoes,Adidas,13999.0,0
Men's adidas Sport Inspired Lite Racer CLN Shoes,Adidas,4999.0,40
Men's adidas Running Jerzo Shoes,Adidas,5299.0,40
Men's adidas Nova Run Shoes,Adidas,8999.0,40
Men's adidas Originals Supercourt RX Shoes,Adidas,12999.0,0
MEN'S ADIDAS OUTDOOR SIKII SHOES,Adidas,5599.0,50
Men's adidas Running Asweerun Shoes,Adidas,5599.0,40
MEN'S ADIDAS OUTDOOR ANDORIAN 2 SHOES,Adidas,4599.0,50
Men's adidas Running Galaxy 4 Shoes,Adidas,5999.0,40
MEN'S ADIDAS OUTDOOR SIKI SHOES,Adidas,5599.0,50
Men's adidas Sport Inspired Run90s Shoes,Adidas,7999.0,40
Men's adidas Sport Inspired Caflaire Shoes,Adidas,5599.0,40
Men's adidas Football Nemeziz 19+ Firm Ground Cleats ,Adidas,22999.0,40
Men's adidas Originals Spezial Winterhill Shoes,Adidas,16999.0,0
Men's adidas Football Nemeziz 19.1 Firm Ground Cleats ,Adidas,14999.0,40
Men's adidas Running SenseBoost GO Shoes,Adidas,11999.0,40
Men's adidas Football X 19.4 Flexible Ground Cleats,Adidas,4599.0,40
Men's adidas Football X 19.3 Firm Ground Cleats,Adidas,6599.0,40
Men's adidas Football X 19.4 Flexible Ground Cleats,Adidas,4599.0,40
Men's adidas Football Nemeziz Messi 19.3 Firm Ground Cleats,Adidas,6599.0,40
Men's adidas Sport Inspired Lite Racer RBN Shoes,Adidas,5999.0,0
Men's adidas Originals by Alexander Wang Futureshell Shoes,Adidas,21999.0,40
Men's adidas Originals Gazelle Shoes,Adidas,7999.0,40
Men's adidas Originals Supercourt Shoes,Adidas,8999.0,40
Men's adidas Outdoor Terrex Easy Trail Shoes,Adidas,5999.0,50
Men's adidas Originals Rivalry Low Shoes,Adidas,7599.0,40
Men's adidas Originals Supercourt Shoes,Adidas,8999.0,40
Men's adidas Originals I-5923 Shoes,Adidas,11999.0,40
Men's adidas Originals Forest Grove Shoes,Adidas,6599.0,40
Men's adidas Sport Inspired Questar Rise Shoes,Adidas,6999.0,40
Men's adidas Originals ZX 4000 Shoes,Adidas,7999.0,40
Men's adidas Originals U_Path Run Shoes,Adidas,7599.0,40
Men's adidas Originals Lxcon 94 Shoes,Adidas,11999.0,40
Men's adidas Originals Swift Run Shoes,Adidas,7599.0,40
Men's adidas Originals Swift Run Shoes,Adidas,7599.0,40
Men's adidas Originals Superstar Shoes,Adidas,7999.0,40
Men's adidas Outdoor Naha Shoes,Adidas,5999.0,50
UNISEX ADIDAS ORIGINALS SKATEBOARDING LUCAS PREMIERE SHOES,Adidas,5999.0,50
men's ADIDAS ORIGINALS STAN SMITH shoes,Adidas,10999.0,60
Men's adidas Basketball Pro Bounce Madness 2019 Shoes,Adidas,9999.0,50
Men's adidas Outdoor Terrex Eastrail Shoes,Adidas,5999.0,40
Men's adidas Running Sedna Shoes,Adidas,4299.0,50
Men's adidas Originals Stan Smith Recon Shoes,Adidas,13999.0,40
Men's adidas Outdoor Echo Sandals,Adidas,2999.0,50
Men's adidas Running Ultraboost 19 Shoes,Adidas,17999.0,30
Men's adidas Running Ultraboost 19 Shoes,Adidas,17999.0,30
Men's Football X 19.3 Turf Boots,Adidas,5999.0,0
Men's adidas Nemeziz 19.4 Flexible Ground Cleats,Adidas,4599.0,0
Men's adidas Training Solar LT Trainers,Adidas,7999.0,40
Men's adidas Running Stunn Shoes,Adidas,5599.0,50
Men's adidas Football Copa 20.3 Firm Ground Boots,Adidas,5999.0,40
Men's adidas Tennis Steadfast 19 Shoes,Adidas,4299.0,50
Women's adidas Sport Inspired VL Court 2.0 Shoes,Adidas,4999.0,40
Men's adidas Football Copa 20.4 Firm Ground Boots,Adidas,3999.0,40
Men's adidas Tennis Steadfast 19 Shoes,Adidas,4299.0,50
Men's adidas Football Predator 19.4 Flexible Ground Boots,Adidas,4599.0,40
Men's adidas Outdoor Entry Hiker Shoes,Adidas,4799.0,40
Men's adidas Football Predator 19.3 Firm Ground Boots,Adidas,6599.0,40
Men's Football X 19.4 Indoor Shoes,Adidas,4599.0,0
Men's Football Nemeziz 19.3 Indoor Shoes,Adidas,5999.0,0
Men's adidas Tennis Stin Indoor Shoes,Adidas,4799.0,40
Men's Football Copa 20.4 Indoor Boots,Adidas,4599.0,0
Men's Football Predator 20.4 Flexible Ground Shoes,Adidas,4599.0,0
Men's Football Nemeziz 19.3 Firm Ground Cleats,Adidas,6599.0,0
Men's Football Predator 20.3 Indoor Boots,Adidas,5999.0,0
Men's Football Copa 20.4 Indoor Boots,Adidas,4599.0,0
Men's Football Predator 20.3 Firm Ground Shoes,Adidas,5999.0,0
Men's Football Predator 20.3 Turf Shoes,Adidas,5999.0,0
Men's Football Copa 20.3 Firm Ground Cleats,Adidas,6599.0,0
Men's Football Copa 20.3 Firm Ground Cleats,Adidas,6599.0,0
Men's Football X 19.3 Turf Boots,Adidas,5999.0,0
Men's adidas Football Nemeziz Messi 19.3 Turf Shoes,Adidas,6999.0,0
Men's Football Predator 20.3 Turf Shoes,Adidas,5999.0,0
Men's Outdoor Wind Chaser II Shoes,Adidas,4999.0,20
Men's Football Predator 20.1 Trainers,Adidas,10999.0,0
Men's adidas Originals CAMPUS Low Shoes ,Adidas,7999.0,50
Men's adidas Outdoor Wind Chaser II Shoes,Adidas,4999.0,20
Men's Outdoor Wind Chaser II Shoes,Adidas,4999.0,20
Men's adidas Originals Yung-1 Shoes,Adidas,10999.0,50
Men's adidas Originals Gazelle Shoes,Adidas,7999.0,50
MEN'S ADIDAS ORIGINALS SKATEBOARDING SEELEY SHOES,Adidas,5999.0,50
MEN'S ADIDAS ORIGINALS GAZELLE SHOES,Adidas,7999.0,50
MEN'S ADIDAS ORIGINALS CAMPUS SHOES,Adidas,8599.0,50
MEN'S ADIDAS ORIGINALS SAMBA OG SHOES,Adidas,7999.0,50
Men's adidas Originals Skateboarding Seeley Shoes,Adidas,6999.0,50
MEN'S ADIDAS ORIGINALS GARWEN SPZL SHOES,Adidas,10999.0,50
Men's adidas Running PureBoost DPR LTD Shoes,Adidas,13999.0,50
Men's adidas Running Pureboost DPR Shoes,Adidas,12999.0,50
Men's adidas Originals Pharrell Williams Tennis HU V2 Shoes,Adidas,9999.0,50
MEN'S ADIDAS ORIGINALS SUPERSTAR SHOES,Adidas,7999.0,50
Men's adidas Originals Yung-96 Shoes,Adidas,8599.0,50
MEN'S ADIDAS OUTDOOR TELL PATH SHOES,Adidas,3999.0,50
Men's adidas Swimming Beach Print Maxout Slippers,Adidas,899.0,50
MEN'S adidas  RUNNING KRAY 2 SHOES,Adidas,4599.0,50
Men's adidas Swim Eezay Maxout II Slippers,Adidas,999.0,50
Men's adidas Running Bolter Shoes,Adidas,4299.0,50
Men's adidas Sport Inspired VL Court 2.0 Shoes,Adidas,5599.0,50
Men's adidas Sport Inspired VL Court 2.0 Shoes,Adidas,5599.0,50
Men's adidas Sports Inspired Daily 2.0 Shoes,Adidas,4999.0,50
MEN'S adidas ORIGINALS NIZZA SHOES,Adidas,6999.0,50
Men's adidas Sport Inspired VL Court 2.0 Shoes,Adidas,5599.0,50
Men's adidas Outdoor Hoist 2019 Sandals,Adidas,2799.0,40
men's ADIDAS ORIGINALS GAZELLE STITCH AND TURN SHOES,Adidas,8999.0,50
Men's ADIDAS ORIGINALS N-5923 SHOES,Adidas,7999.0,50
MEN'S ADIDAS SPORT INSPIRED LITE RACER BYD SHOES,Adidas,5999.0,50
men's ADIDAS ORIGINALS PW TENNIS HU PK SHOES,Adidas,12999.0,50
MEN'S ADIDAS ORIGINALS F/22 PRIMEKNIT SHOES,Adidas,11999.0,50
MEN'S ADIDAS ORIGINALS GAZELLE SHOES,Adidas,7999.0,50
MEN'S ADIDAS ORIGINALS CONTINENTAL 80 SHOES,Adidas,7999.0,50
MEN'S ADIDAS ORIGINALS SUPERSTAR 80S RECON SHOES,Adidas,11999.0,50
MEN'S ADIDAS ORIGINALS NMD_TS1 PRIMEKNIT SHOES,Adidas,14999.0,50
MEN'S ADIDAS ORIGINALS SAMBA OG SHOES,Adidas,7999.0,50
MEN'S ADIDAS ORIGINALS SUPERSTAR 80S SHOES,Adidas,8999.0,50
MEN'S ADIDAS ORIGINALS DEERUPT RUNNER SHOES,Adidas,9999.0,50
MEN'S ADIDAS ORIGINALS SUPERSTAR 80S CLEAN SHOES,Adidas,8999.0,50
MEN'S ADIDAS ORIGINALS NMD_CS1 PRIMEKNIT SHOES,Adidas,14999.0,50
MEN'S ADIDAS ORIGINALS SKATEBOARDING SEELEY SHOES,Adidas,5999.0,50
MEN'S ADIDAS ORIGINALS CAMPUS SHOES,Adidas,7999.0,50
MEN'S ADIDAS ORIGINALS POD-S3.1 SHOES,Adidas,12999.0,50
MEN'S ADIDAS ORIGINALS CAMPUS PRIDE SHOES,Adidas,7999.0,50
Men's adidas Originals A.R. Trainer Shoes,Adidas,8999.0,50
Men's adidas Originals N-5923 Shoes,Adidas,7599.0,50
Men's adidas Originals Campus Shoes,Adidas,7999.0,50
Men's adidas Originals EQT Support Mid ADV Shoes,Adidas,9999.0,50
Men's adidas Originals Micropacer X R1 Shoes,Adidas,18999.0,50
Men's adidas Originals Yung-96 Shoes,Adidas,8599.0,50
Men's adidas Football Predator 19.3 Turf Boots,Adidas,6599.0,40
Men's adidas Originals Earlham SPZL Shoes,Adidas,10999.0,50
Men's adidas Originals X_PLR Shoes,Adidas,7999.0,50
MEN'S ADIDAS RUNNING ARGECY SHOES,Adidas,5599.0,50
Men's adidas RUNNING ZETA 1.0 SHOES,Adidas,5999.0,50
men's ADIDAS RUNNING ZETA 1.0 SHOES,Adidas,5999.0,50
Men's adidas Sport Inspired Cloudfoam Racer TR Shoes,Adidas,5999.0,50
Men's adidas Running 8K Shoes,Adidas,5599.0,50
men's ADIDAS ORIGINALS PW HU HOLI STAN SMITH SHOES,Adidas,9999.0,50
MEN'S ADIDAS RUNNING ZETA 1.0 SHOES,Adidas,5999.0,50
Men's adidas Sport Inspired Cloudfoam Racer TR Shoes,Adidas,5999.0,50
MEN'S ADIDAS RUNNING PUARO SHOES,Adidas,4999.0,50
MEN'S ADIDAS RUNNING ADISTARK 3.0 SHOES,Adidas,3999.0,50
Men's adidas Sport Inspired Zelt 2.0 Slip-Ons,Adidas,4799.0,50
Men's adidas Originals Supercourt Shoes,Adidas,7599.0,40
Men's adidas Running Zeta 1.0 Shoes,Adidas,5999.0,50
Men's adidas Originals Nite Jogger Shoes,Adidas,12999.0,40
Men's adidas Originals Yung-1 Shoes,Adidas,10999.0,40
Men's adidas Originals Sobakov Shoes,Adidas,10999.0,40
Men's adidas Originals U_Path Run Shoes,Adidas,7599.0,40
Men's adidas Originals Swift Run Shoes,Adidas,7599.0,40
Men's adidas Originals Rivalry RM Low Shoes,Adidas,10999.0,40
Men's adidas Originals Temper Run Shoes,Adidas,12999.0,40
Men's adidas Originals Yung-96 Chasm Shoes,Adidas,7999.0,40
Men's adidas Originals Rivalry Low Shoes,Adidas,7599.0,40
Men's adidas Originals Rivalry RM Low Shoes,Adidas,10999.0,40
Men's adidas Outdoor Terrex Eastrail Mid GTX Shoes,Adidas,11999.0,40
Men's adidas Running PureBounce+ Clima Shoes,Adidas,8999.0,50
Men's adidas Originals U_Path Run Shoes,Adidas,7599.0,40
Men's adidas Originals Yung-96 Chasm Shoes,Adidas,7999.0,40
Men's adidas Swimming Eezay 2019 Slippers,Adidas,1499.0,0
Men's adidas Running PureBounce+ Street Shoes ,Adidas,7999.0,50
Men's adidas Sport Inspired Drogo Shoes,Adidas,2699.0,30
MEN'S ADIDAS ORIGINALS FOREST GROVE SHOES,Adidas,6999.0,50
Men's adidas Outdoor Adipu 2019 Sandals,Adidas,2999.0,40
MEN'S ADIDAS ORIGINALS SWIFT RUN SHOES,Adidas,7599.0,50
MEN'S ADIDAS ORIGINALS SUPERSTAR 80S CLEAN SHOES,Adidas,8999.0,50
MEN'S ADIDAS ORIGINALS X_PLR SHOES,Adidas,7999.0,50
Men's adidas Originals Tubular Dusk Shoes,Adidas,7999.0,50
Men's adidas Outdoor Adipu 2019 Sandals,Adidas,2999.0,40
Men's adidas Running Nayo 2.0 Shoes,Adidas,5299.0,50
Men's adidas Originals X_PLR Shoes,Adidas,7999.0,50
Men's adidas Running UltraBoost Shoes,Adidas,19999.0,30
Men's adidas Sport Inspired Netpoint Shoes,Adidas,6599.0,40
Men's adidas Sport Inspired Court 70s Shoes,Adidas,5599.0,50
Men's adidas Sport Inspired VS Advantage Clean Shoes ,Adidas,4599.0,50
Men's adidas RunFalcon Shoes,Adidas,5999.0,50
MEN'S ADIDAS SPORT INSPIRED COURT 70S SHOES,Adidas,5599.0,50
MEN'S ADIDAS SPORT INSPIRED CAFLAIRE SHOES,Adidas,5599.0,50
MEN'S ADIDAS SPORT INSPIRED COURT 70S SHOES,Adidas,5599.0,50
Men's adidas Swim Gadi Slippers,Adidas,1499.0,50
Men's adidas Originals Samba OG Shoes,Adidas,8999.0,40
Men's adidas Outdoor Terrex Tracerocker GTX Shoes,Adidas,9999.0,40
Men's adidas Outdoor Storm Raiser II Shoes,Adidas,4799.0,40
Men's adidas Originals Nite Jogger Shoes,Adidas,12999.0,30
Men's adidas Originals Stan Smith Shoes,Adidas,10999.0,0
MEN'S ADIDAS ORIGINALS CONTINENTAL 80 SHOES,Adidas,7999.0,50
Men's adidas Running Bound Shoes,Adidas,4999.0,50
Men's adidas Sport Inspired Questar Rise Shoes,Adidas,6999.0,50
Men's adidas Sport Inspired Strikerr Shoes,Adidas,4599.0,40
Men's adidas Sport Inspired Nebular 2 Shoes,Adidas,4999.0,50
Men's adidas Sport Inspired Nebular 2 Shoes,Adidas,4999.0,50
Men's adidas Running 90s Valasion Shoes,Adidas,8999.0,50
Men's adidas Football Predator 19.1 Firm Ground Cleats,Adidas,14999.0,40
Men's adidas Outdoor Hoist 2019 Sandals,Adidas,2799.0,40
Men's adidas Outdoor Mode Sandals ,Adidas,2499.0,50
Men's adidas Outdoor Naha Shoes,Adidas,5999.0,50
Men's adidas Outdoor Mode Sandals ,Adidas,2499.0,50
Men's adidas Tennis Wucht Indoor Shoes,Adidas,4599.0,40
Men's adidas Basketball Pro Bounce 2019 Shoes,Adidas,12999.0,40
Men's adidas Basketball N3XT L3V3L Shoes,Adidas,16999.0,40
Men's adidas Tennis Gumption III Shoes,Adidas,4299.0,40
Men's adidas Comfort Flip Flops,Adidas,2799.0,0
Men's adidas Tennis Gumption III Shoes,Adidas,4299.0,40
Men's Outdoor Terra Light Sandals,Adidas,3599.0,0
MEN'S ADIDAS RUNNING SOLAR DRIVE SHOES,Adidas,10999.0,40
MEN'S ADIDAS ORIGINALS MARATHON X 5923 SHOES,Adidas,12999.0,50
Men's adidas Running SenseBounce+ Street Shoes,Adidas,7999.0,40
Men's adidas Running Alphabounce+ Parley Shoes,Adidas,9999.0,40
Men's Running Adizero RC 2.0 Shoes,Adidas,8999.0,0
Men's adidas Running PureBounce+ Shoes,Adidas,9999.0,40
Men's adidas Running Alphabounce+ Shoes,Adidas,9999.0,40
Men's adidas Sport Inspired Run90s Shoes,Adidas,7999.0,40
