product,brand,original_price,discount_rate
Unisex adidas Running Alphabounce+ Shoes,Adidas,9999.0,40
Women's adidas Training Alphabounce Trainer Shoes,Adidas,9599.0,50
Men's adidas Sport Inspired Blaze Runner Shoes,Adidas,5599.0,20
WOMEN'S ADIDAS ORIGINALS TUBULAR SHADOW CK SHOES,Adidas,7999.0,50
WOMEN'S ADIDAS ORIGINALS FLB_RUNNER SHOES,Adidas,6999.0,50
Women's ADIDAS ORIGINALS COURTVANTAGE VULCANIZED SHOES,Adidas,6999.0,50
Men's adidas Running Dracon Shoes,Adidas,3999.0,20
Women's adidas Originals Falcon Shoes,Adidas,10999.0,0
WOMEN'S ADIDAS ORIGINALS CONTINENTAL 80 SHOES,Adidas,7999.0,50
Women's adidas Originals NMD_CS1 Primeknit Shoes,Adidas,14999.0,50
WOMEN'S ADIDAS ORIGINALS FOREST GROVE SHOES,Adidas,6999.0,50
Women's adidas Originals Rivalry Low Shoes,Adidas,10999.0,0
Women's adidas Originals Sambarose Shoes,Adidas,10999.0,0
Women's adidas Originals Stan Smith Shoes,Adidas,10999.0,0
Women's adidas Originals Sambarose Shoes,Adidas,10999.0,0
Women's adidas Originals Rivalry Low Shoes,Adidas,10999.0,0
Women's adidas Originals Magmur Runner Shoes,Adidas,11999.0,0
Women's adidas Originals Sambarose Shoes,Adidas,10999.0,0
Women's adidas Originals Supercourt RX Shoes,Adidas,12999.0,0
Women's adidas Originals Falcon Shoes,Adidas,10999.0,0
Women's adidas Originals Swift Run Shoes,Adidas,7999.0,50
Women's adidas Sport Inspired Duramo Lite 2.0 Shoes,Adidas,4799.0,50
Women's adidas Originals Rivalry Low Shoes,Adidas,10999.0,0
Women's adidas Originals Falcon Shoes,Adidas,10999.0,0
WOMEN'S ADIDAS SPORT INSPIRED CLOUDFOAM RACER TR SHOES,Adidas,5599.0,50
Men's adidas Sport Inspired Questar Flow Shoes,Adidas,6999.0,50
WOMEN'S ADIDAS SPORT INSPIRED ULTIMAMOTION SHOES,Adidas,5599.0,50
WOMEN'S ADIDAS ORIGINALS EQT SUPPORT SOCK PRIMEKNIT SHOES,Adidas,9999.0,50
WOMEN'S ADIDAS ORIGINALS EQT SUPPORT SOCK PRIMEKNIT SHOES,Adidas,9999.0,50
Women's adidas Originals Magmur Runner Shoes,Adidas,11999.0,0
WOMEN'S ADIDAS SPORT INSPIRED QUESTAR RIDE SHOES,Adidas,6599.0,50
WOMEN'S ADIDAS ORIGINALS CAMPUS SHOES,Adidas,7999.0,50
WOMEN'S ADIDAS RUNNING PUREMOTION SHOES,Adidas,5999.0,50
WOMEN'S ADIDAS SPORT INSPIRED CLOUDFOAM ULTIMATE SHOES,Adidas,6599.0,50
Women's adidas Sport Inspired Duramo Lite 2.0 Shoes,Adidas,4799.0,50
Women's adidas Khoe Run Shoes,Adidas,5599.0,50
WOMEN'S ADIDAS SPORT INSPIRED RUN 70S SHOES,Adidas,6599.0,50
Women's adidas Originals Pharrell Williams Tennis HU Shoes,Adidas,8999.0,50
Women's adidas Originals Taekwondo Shoes,Adidas,7999.0,50
UNISEX ADIDAS ORIGINALS MARATHON X 5923 SHOES,Adidas,12999.0,50
Women's adidas Originals I-5923 Shoes,Adidas,11999.0,40
Women's adidas Originals Falcon RX Shoes,Adidas,11999.0,40
Women's adidas Originals Nite Jogger Shoes,Adidas,12999.0,40
WOMEN'S ADIDAS ORIGINALS STAN SMITH SOCK PK SHOES,Adidas,12999.0,60
Women's adidas ORIGINALS ATTITUDE REVIVE Mid Shoes ,Adidas,8999.0,60
Unisex adidas Originals Marathon Tech Shoes,Adidas,12999.0,40
Women's adidas ORIGINALS ZX FLUX ADV VERVE Low Shoes ,Adidas,8999.0,60
Unisex adidas Originals Marathon Tech Shoes,Adidas,11999.0,40
Unisex adidas Originals Marathon Tech Shoes,Adidas,11999.0,40
Unisex adidas Originals Marathon Tech Shoes,Adidas,11999.0,40
Women's adidas Sport Inspired Lite Racer CLN Shoes,Adidas,4599.0,40
Women's adidas Originals EQT Gazelle Shoes,Adidas,8999.0,40
Unisex adidas Originals Skateboarding 2MC Shoes,Adidas,5999.0,40
Women's ADIDAS ORIGINALS CAMPUS STITCH AND TURN SHOES,Adidas,8999.0,50
Women's ADIDAS ORIGINALS CAMPUS SHOES,Adidas,7599.0,50
Women's ADIDAS ORIGINALS CAMPUS SHOES,Adidas,7599.0,50
Unisex adidas Originals Continental Vulc Shoes,Adidas,7599.0,40
Women's ADIDAS ORIGINALS TUBULAR VIRAL SHOES,Adidas,7999.0,50
Women's adidas Originals Campus Shoes,Adidas,7999.0,50
Women's adidas originals NMD_RACER PRIMEKNIT SHOES,Adidas,16999.0,50
Women's ADIDAS ORIGINALS GAZELLE STITCH AND TURN SHOES,Adidas,8999.0,50
Men's Running Stargon 1.0 Shoes,Adidas,4799.0,20
Men's adidas Running Pull On Shoes,Adidas,4799.0,20
Men's adidas Sport Inspired Blaze Runner Shoes,Adidas,5599.0,20
WOMEN'S ADIDAS ORIGINALS CAMPUS SHOES,Adidas,7999.0,50
MEN'S ADIDAS ORIGINALS FOREST GROVE SHOES,Adidas,6999.0,50
Men's adidas Sport Inspired Heawin Shoes,Adidas,4999.0,50
Men's adidas Running Solar Drive Shoes,Adidas,9999.0,40
Men's adidas Running Solar Drive 19 Shoes,Adidas,11999.0,40
Men's adidas Sport Inspired Heawin Shoes,Adidas,4999.0,50
Men's adidas Running Solar Drive Shoes,Adidas,9999.0,40
Men's adidas Running SenseBounce+ Street Shoes,Adidas,7999.0,40
Men's adidas Running Solar Blaze Shoes,Adidas,7999.0,40
Men's adidas Running Solar Glide 19 Shoes ,Adidas,13999.0,40
Men's adidas Running Solar Drive 19 Shoes,Adidas,11999.0,40
Men's adidas Running Solar Drive 19 Shoes,Adidas,11999.0,40
Men's adidas Running SenseBoost GO LTD Shoes,Adidas,11999.0,40
Men's adidas Running Solar Glide 19 Shoes ,Adidas,13999.0,40
Men's adidas Running SenseBoost GO Shoes,Adidas,11999.0,40
Men's adidas Running Solar Boost 19 Shoes,Adidas,15999.0,40
Men's adidas Running SenseBoost GO Shoes,Adidas,11999.0,40
Men's adidas Running SenseBoost GO Shoes,Adidas,11999.0,40
Men's adidas Running Edge Flex Shoes,Adidas,7999.0,40
Men's adidas Running AlphaBoost BF Shoes,Adidas,14999.0,40
Men's adidas Running Pulseboost HD Winter Shoes,Adidas,13999.0,40
Men's adidas Running Edge Flex Shoes,Adidas,7999.0,40
Men's adidas Running Pull On Shoes,Adidas,4799.0,20
Men's adidas Running Pulseboost HD Winter Shoes,Adidas,13999.0,40
Men's adidas Running Asweego Shoes,Adidas,7999.0,40
MEN'S ADIDAS ORIGINALS SAMBA OG SHOES,Adidas,7999.0,0
men's ADIDAS RUNNING NEBULAR SHOES,Adidas,4599.0,60
Men's adidas Swimming Eezay 2019 Slippers,Adidas,1499.0,40
Men's adidas Originals Continental 80 Shoes,Adidas,7999.0,40
MEN'S ADIDAS SPORT INSPIRED COURT 70S SHOES,Adidas,7999.0,50
Men's adidas Outdoor Storm Raiser II Shoes,Adidas,4799.0,40
Men's adidas Originals X_PLR Shoes,Adidas,7599.0,40
Men's adidas Running Rush Shoes,Adidas,3599.0,50
Men's adidas Running Fluo Shoes,Adidas,3799.0,50
MEN'S ADIDAS ORIGINALS YUNG 1 SHOES,Adidas,10999.0,40
Men's adidas Originals Superstar MG Shoes,Adidas,7999.0,0
Men's adidas Originals I-5923 Shoes,Adidas,11999.0,50
MEN'S ADIDAS ORIGINALS CAMPUS SHOES,Adidas,7999.0,50
Men's adidas Originals NMD_R1 Shoes,Adidas,12999.0,40
Men's adidas Sport Inspired Lyrid Slip-ons,Adidas,4599.0,50
MEN'S ADIDAS ORIGINALS TEMPER RUN SHOES,Adidas,11999.0,50
Men's adidas Originals A.R. Trainers,Adidas,7999.0,40
Men's adidas Outdoor Argo Trek 19 Shoes,Adidas,3999.0,40
Men's adidas Sport Inspired Questar Ride Shoes,Adidas,7599.0,40
MEN'S ADIDAS SPORT INSPIRED COURT ADAPT SHOES,Adidas,5999.0,50
Men's adidas Outdoor Adipu 2019 Sandals,Adidas,2999.0,40
Men's adidas Football Copa 19.4 Firm Ground Cleats,Adidas,3999.0,40
Men's adidas Originals Sobakov P94 Shoes,Adidas,7599.0,40
Men's adidas Running Questar Ride Shoes,Adidas,7999.0,50
Men's adidas Sport Inspired Grand Court Shoes,Adidas,5999.0,50
MEN'S ADIDAS SPORT INSPIRED COURT 70S SHOES,Adidas,5599.0,50
MEN'S ADIDAS RUNNING RADDIS 1.0 SHOES,Adidas,5599.0,50
Men's adidas Running Cosmic 2 Shoes,Adidas,6999.0,50
MEN'S ADIDAS RUNNING RYZO 4.0 SHOES,Adidas,4599.0,50
Men's adidas Sport Inspired Grand Court Shoes,Adidas,5999.0,50
Men's adidas Sport Inspired Duramo Lite 2.0 Shoes,Adidas,4999.0,50
Men's adidas Sport Inspired VS Advantage Clean Shoes ,Adidas,4599.0,50
WOMEN'S ADIDAS ORIGINALS SAMBAROSE SHOES,Adidas,7999.0,50
Men's Sport Inspired Run60s Shoes,Adidas,5599.0,30
WOMEN'S ADIDAS ORIGINALS CAMPUS SHOES,Adidas,7999.0,50
Women's adidas Originals Sleek Shoes,Adidas,7599.0,50
WOMEN'S ADIDAS ORIGINALS SWIFT RUN SHOES,Adidas,7599.0,50
WOMEN'S ADIDAS ORIGINALS STAN SMITH NEW BOLD SHOES,Adidas,8999.0,50
WOMEN'S ADIDAS ORIGINALS TUBULAR SHADOW CK SHOES,Adidas,7999.0,50
WOMEN'S ADIDAS ORIGINALS STAN SMITH NEW BOLD SHOES,Adidas,8999.0,50
WOMEN'S ADIDAS ORIGINALS FOREST GROVE SHOES,Adidas,6999.0,50
WOMEN'S ADIDAS ORIGINALS NMD_R1 SHOES,Adidas,11999.0,50
WOMEN'S ADIDAS ORIGINALS SAMBAROSE SHOES,Adidas,7999.0,50
WOMEN'S ADIDAS ORIGINALS SAMBAROSE SHOES,Adidas,7999.0,50
WOMEN'S ADIDAS ORIGINALS N-5923 SHOES,Adidas,7599.0,50
WOMEN'S ADIDAS ORIGINALS FALCON SHOES,Adidas,8599.0,50
Women's adidas Originals N-5923 Shoes,Adidas,7599.0,50
Women's adidas Originals Samba OG Shoes,Adidas,7999.0,50
Women's adidas Originals Samba OG Shoes,Adidas,7999.0,50
WOMEN'S ADIDAS ORIGINALS NMD_R1 SHOES,Adidas,11999.0,50
Women's adidas Originals Pharrell Williams Tennis HU Shoes,Adidas,8999.0,50
Women's adidas Originals NMD_R1 Shoes,Adidas,11999.0,50
WOMEN'S ADIDAS ORIGINALS GAZELLE SHOES,Adidas,7999.0,50
Women's adidas Originals Continental 80 Shoes,Adidas,7999.0,50
Women's adidas Originals POD-S3.1 Shoes,Adidas,13999.0,50
Women's adidas Originals U_Path Run Shoes,Adidas,7999.0,50
Women's adidas Originals Sleek S Shoes,Adidas,7599.0,50
Women's adidas Sport Inspired Lite Racer Shoes,Adidas,4299.0,40
Women's adidas Originals Sleek Mid Shoes,Adidas,7999.0,50
Unisex Adidas ORIGINALS SKATEBOARDING ADI-EASE VULCANIZED SHOES,Adidas,6999.0,50
WOMEN'S ADIDAS ORIGINALS PROPHERE SHOES,Adidas,10999.0,50
Unisex adidas Originals Skateboarding Sabalo Slip-Ons,Adidas,6999.0,50
Unisex Adidas ORIGINALS SKATEBOARDING KIEL SHOES,Adidas,6999.0,50
Unisex adidas Originals Lucas Premiere Shoes,Adidas,7599.0,50
Women's adidas Originals Arkyn Shoes,Adidas,11999.0,50
Unisex adidas Originals Lucas Premiere Shoes,Adidas,7599.0,50
Women's adidas Originals EQT Support 91/18 Shoes,Adidas,13999.0,50
Women's adidas Originals Pharrell Williams Tennis HU Shoes,Adidas,8999.0,50
Women's adidas Sport Inspired Heawin Shoes,Adidas,4599.0,40
Women's adidas Sport Inspired Heawin Shoes,Adidas,4599.0,40
Women's adidas By Stella Mccartney PureBoost Trainers,Adidas,12999.0,40
Women's adidas Sport Inspired Heawin Shoes,Adidas,4599.0,40
Women's adidas Sports Inspired Daily 2.0 Shoes,Adidas,4599.0,40
Women's adidas Adilette Comfort Slides,Adidas,3299.0,0
Women's adidas Sport Inspired VL Court 2.0 Shoes,Adidas,4999.0,40
Women's adidas Training Alphabounce Trainer Shoes,Adidas,9599.0,40
Women's adidas Adilette Comfort Slides,Adidas,3599.0,0
Women's adidas Tarining Solar Lt Trainers,Adidas,7599.0,40
Women's adidas Adilette Comfort Slides,Adidas,3599.0,0
Women's Swim Eezay Flip-Flops,Adidas,1999.0,0
Unisex adidas Swim Adilette Aqua Slides,Adidas,3599.0,0
Women's adidas Swim Ozor 2.0 Slippers,Adidas,1299.0,0
Women's adidas Swim Eezay Flip-Flops,Adidas,1999.0,0
Women's adidas Originals Nizza Shoes,Adidas,5999.0,40
Women's adidas Originals Supercourt Shoes,Adidas,7599.0,40
Women's adidas Originals NMD_R1 Shoes,Adidas,12999.0,40
Women's adidas Swim Ozor 2.0 Slippers,Adidas,1299.0,0
Women's adidas Originals Nite Jogger Shoes,Adidas,12999.0,40
Women's adidas Originals SUPERSTAR BW3S SLIP On,Adidas,7599.0,60
Women's adidas Originals Rivalry Low Shoes,Adidas,7599.0,40
Men's adidas Sport Inspired Cloudfoam Racer TR Shoes,Adidas,5999.0,50
Women's adidas  RUNNING cosmic 2  Low Shoes ,Adidas,5999.0,60
Women's adidas Swim Ozor 2.0 Slippers,Adidas,1299.0,0
MEN'S ADIDAS RUNNING KYLEN 1.0 SHOES,Adidas,4999.0,50
Men's adidas Sport Inspired Arcadeis Shoes,Adidas,4599.0,50
Women's adidas Originals ZX Torsion Shoes,Adidas,11999.0,40
Men's adidas Sport Inspired Zeta 1.0 Shoes,Adidas,5999.0,50
Men's adidas Originals Temper Run Shoes,Adidas,12999.0,40
Men's adidas Originals Forest Grove Shoes,Adidas,7999.0,40
MEN'S ADIDAS ORIGINALS CAMPUS SHOES,Adidas,7999.0,50
Men's adidas Sport Inspired Questar Flow Shoes,Adidas,6999.0,50
Men's adidas Originals Continental 80 Shoes,Adidas,7999.0,40
Men's adidas Sport Inspired Lite Racer Clean Shoes,Adidas,4599.0,50
Men's adidas Originals Forest Grove Shoes,Adidas,6599.0,40
Men's adidas Original X_PLR Shoes,Adidas,7599.0,40
Men's adidas Originals EQT Gazelle Shoes,Adidas,8999.0,40
Men's Originals Crazy BYW X 2.0 Shoes,Adidas,14999.0,40
Men's adidas Originals U_Path Run Shoes,Adidas,7599.0,40
Men's adidas Originals SC Premiere Shoes,Adidas,10999.0,40
MEN'S ADIDAS ORIGINALS SKATEBOARDING SEELEY SHOES,Adidas,6999.0,50
Men's adidas RUNNING TORIL 1.0 SHOES,Adidas,4999.0,50
Men's adidas Originals Rivalry Low Shoes,Adidas,7599.0,40
Men's adidas Sport Inspired Court Adapt Shoes ,Adidas,5999.0,30
Men's adidas Originals EQT Gazelle Shoes,Adidas,8999.0,40
Men's Sport Inspired Advantage Shoes,Adidas,5999.0,30
MEN'S ADIDAS RUNNING 8K SHOES,Adidas,5599.0,50
MEN'S ADIDAS SPORT INSPIRED CAFLAIRE SHOES,Adidas,5599.0,30
MEN'S ADIDAS RUNNING ERDIGA 4.0 SHOES,Adidas,4599.0,50
Men's adidas Sport Inspired Glenn M Shoes,Adidas,2499.0,30
Men's adidas Sport Inspired Questar Ride Shoes,Adidas,7599.0,50
Men's adidas Sport Inspired Shoes ,Adidas,2699.0,30
Men's adidas Running Fluo Shoes,Adidas,3799.0,50
Men's adidas Running Norad Shoes ,Adidas,4999.0,50
Men's Sport Inspired Court Adapt Shoes ,Adidas,5999.0,30
MEN'S ADIDAS OUTDOOR TERREX CMTK SHOES,Adidas,4999.0,50
Men's Sport Inspired Caflaire Shoes ,Adidas,5599.0,30
MEN'S ADIDAS RUNNING FLUIDCLOUD NEUTRAL SHOES,Adidas,5999.0,50
Men's adidas Originals Nizza Shoes,Adidas,5999.0,40
Men's adidas Originals Forest Grove Shoes,Adidas,7999.0,40
MEN'S ADIDAS RUNNING ERDIGA 3.0 SHOES,Adidas,4299.0,50
Men's adidas Sport Inspired Zeta 2.0 Shoes,Adidas,4599.0,50
Men's adidas Sport Inspired VL Court 2.0 Shoes,Adidas,5599.0,40
MEN'S ADIDAS SPORT INSPIRED CLOUDFOAM LITE RACER SHOES,Adidas,5999.0,50
Men's adidas Football Nemeziz 19.3 Indoor Shoes,Adidas,5999.0,40
Men's adidas Sport Inspired VL Court 2.0 Shoes,Adidas,5599.0,40
Men's adidas Football Copa 19+ Firm Ground Cleats,Adidas,22999.0,40
Men's adidas Football Predator 19.3 Indoor Shoes,Adidas,5999.0,40
Men's adidas Sport Inspired Quickspike Shoes,Adidas,3999.0,50
Men's adidas Sport Inspired Lite Racer Reborn Shoes,Adidas,5999.0,50
Men's adidas Running PureBounce+ Street Shoes ,Adidas,7999.0,50
Men's adidas Running Solar Blaze Shoes,Adidas,7999.0,50
Men's adidas Outdoor Elevate 2018 Sandals,Adidas,2799.0,40
MEN'S ADIDAS RUNNING DURAMO 9 SHOES,Adidas,6599.0,50
Men's adidas Outdoor Hoist 2019 Sandals,Adidas,2799.0,40
Men's adidas Outdoor Argo Trek 19 Shoes,Adidas,3999.0,40
Men's adidas Sport Inspired Drogo 2.0 Shoes,Adidas,2699.0,30
Men's adidas Sport Inspired Questar BYD Shoes,Adidas,6999.0,40
MEN'S ADIDAS RUNNING ERDIGA 4.0 SHOES,Adidas,4599.0,50
Men's adidas Sport Inspired Heawin Shoes,Adidas,4999.0,50
MEN'S ADIDAS RUNNING KYLEN 1.0 SHOES,Adidas,4999.0,50
Men's adidas Sport Inspired Drogo Shoes,Adidas,2699.0,30
Men's adidas Sport Inspired Fassar Shoes,Adidas,3999.0,50
WOMEN's adidas ORIGINALS TUBULAR DAWN SHOES,Adidas,9999.0,60
MEN'S ADIDAS FOOTBALL PREDATOR 19.1 TRAINERS,Adidas,10999.0,50
Women's adidas Sport Inspired Hyperon 1.0 Shoes,Adidas,2999.0,0
Women's adidas Sport Inspired Hyperon 1.0 Shoes,Adidas,2999.0,0
WOMEN'S ADIDAS SPORT INSPIRED QT FLEX SHOES,Adidas,5599.0,40
Women's adidas Originals Magmur Runner Shoes,Adidas,11999.0,0
Women's adidas Sport Inspired Yatra Shoes,Adidas,4299.0,40
Women's adidas Sport Inspired Cloudfoam Racer TR Shoes,Adidas,5599.0,40
Women's adidas Sport Inspired Run 60s Shoes,Adidas,4999.0,40
Women's adidas Sport Inspired Crazychaos Shoes,Adidas,6599.0,40
Women's adidas Running EnergyFalcon X Shoes,Adidas,6599.0,40
Women's adidas Running Duramo 9 Shoes,Adidas,5999.0,40
Women's adidas Sport Inspired Archivo Shoes,Adidas,4999.0,40
Women's adidas Originals NMD_R1 Shoes,Adidas,12999.0,40
Women's adidas Originals EQT Gazelle Shoes,Adidas,8999.0,40
Women's adidas Originals ZX Torsion Shoes,Adidas,11999.0,40
Women's adidas Originals I-5923 Shoes,Adidas,11999.0,40
Unisex adidas Originals Marathon Tech Shoes,Adidas,12999.0,40
Women's adidas Originals Supercourt Shoes,Adidas,7999.0,40
Unisex adidas Originals Skateboarding Sabalo Slip-Ons,Adidas,5999.0,40
Unisex adidas Originals Continental Vulc Shoes,Adidas,6599.0,0
Unisex adidas Originals Continental Vulc Shoes,Adidas,7599.0,40
Unisex adidas Originals Superstar Shoes,Adidas,10999.0,0
Women's adidas Originals Gazelle Shoes,Adidas,7999.0,40
Unisex adidas Originals Continental Vulc Shoes,Adidas,6599.0,0
Unisex adidas Originals Skateboarding 3MC Shoes,Adidas,5999.0,0
Unisex adidas Originals Superstar Shoes,Adidas,10999.0,0
Unisex adidas Originals Superstar Shoes,Adidas,10999.0,0
Unisex Originals Skateboarding 3MC Shoes,Adidas,5999.0,0
Unisex adidas Originals Marathon Tech Shoes,Adidas,12999.0,0
Unisex adidas Originals Continental Vulc Shoes,Adidas,7599.0,0
Unisex adidas Originals Marathon Tech Shoes,Adidas,11999.0,0
Women's adidas originals ARKYN SHOES,Adidas,11999.0,50
WOMEN'S ADIDAS ORIGINALS STAN SMITH NEW BOLD SHOES,Adidas,8999.0,50
Women's adidas ORIGINALS NMD_R1 PK SHOES,Adidas,15999.0,50
WOMEN'S ADIDAS ORIGINALS DEERUPT SHOES,Adidas,9999.0,50
WOMEN'S ADIDAS ORIGINALS ARKYN PRIMEKNIT SHOES,Adidas,11999.0,50
WOMEN'S ADIDAS ORIGINALS NMD_CS1 PRIMEKNIT SHOES,Adidas,14999.0,50
WOMEN'S ADIDAS ORIGINALS PROPHERE SHOES,Adidas,10999.0,50
WOMEN'S ADIDAS ORIGINALS SAMBAROSE SHOES,Adidas,7999.0,50
Women's adidas Originals Arkyn Shoes,Adidas,11999.0,50
WOMEN'S ADIDAS ORIGINALS ARKYN PRIMEKNIT SHOES,Adidas,11999.0,50
WOMEN'S ADIDAS ORIGINALS SAMBAROSE SHOES,Adidas,7999.0,40
Women's adidas Originals Continental 80 Shoes,Adidas,7999.0,40
Women's adidas Originals Rivalry Low Shoes,Adidas,7599.0,40
Women's adidas Originals Falcon Shoes,Adidas,7999.0,40
Women's adidas  fluidcloud  Low Shoes ,Adidas,7499.0,60
Women's adidas Originals POD-S3.1 Shoes,Adidas,11999.0,40
Women's ADIDAS ORIGINALS FLB_RUNNER SHOES,Adidas,7999.0,50
WOMEN'S ADIDAS SPORT INSPIRED FUSION FLOW SHOES,Adidas,6299.0,50
Women's adidas Originals NMD_R1 Shoes,Adidas,12999.0,40
WOMEN'S adidas ORIGINALS ARKYN SHOES,Adidas,11999.0,50
Women's ADIDAS ORIGINALS GAZELLE STITCH AND TURN SHOES,Adidas,8999.0,50
WOMEN'S ADIDAS RUNNING QUESA SHOES,Adidas,6999.0,50
Women's ADIDAS ORIGINALS FLB_RUNNER SHOES,Adidas,7999.0,50
WOMEN'S ADIDAS RUNNING QUESA SHOES,Adidas,6999.0,50
WOMEN'S ADIDAS RUNNING COSMIC 2 SHOES,Adidas,5999.0,50
WOMEN'S ADIDAS RUNNING PUREMOTION SHOES,Adidas,5999.0,50
WOMEN'S ADIDAS ORIGINALS STAN SMITH NEW BOLD SHOES,Adidas,8999.0,50
Men's adidas Running Stunn Shoes,Adidas,5599.0,50
Men's adidas Running Galaxy 4 Shoes,Adidas,5299.0,50
MEN'S ADIDAS ORIGINALS TUBULAR DUSK SHOES,Adidas,7999.0,40
Men's adidas Sport Inspired Arcadeis Shoes,Adidas,4599.0,50
Women's ADIDAS ORIGINALS FLB_RUNNER SHOES,Adidas,7999.0,50
WOMEN'S ADIDAS ORIGINALS DEERUPT SHOES,Adidas,9999.0,50
Men's adidas Running Furio Lite 1.0 Shoes,Adidas,3599.0,40
Men's adidas Running Solar Boost ST 19 Shoes,Adidas,15999.0,40
Men's adidas Running Solar Drive 19 Shoes,Adidas,11999.0,40
Men's adidas Sport Inspired Videll Shoes,Adidas,3799.0,50
Men's adidas Running Solar Drive 19 Shoes,Adidas,11999.0,40
Men's adidas Originals A.R. Trainer Shoes,Adidas,7999.0,40
Men's adidas Originals Yung-96 Shoes,Adidas,7999.0,40
Men's adidas Originals EQT Gazelle Shoes,Adidas,8999.0,40
Men's adidas Running Solar Glide ST 19 Shoes ,Adidas,13999.0,40
Men's adidas Outdoor Mode Sandals ,Adidas,2499.0,40
Men's adidas Running Solar Boost 19 Shoes,Adidas,15999.0,40
Men's adidas Terra Sport 19 Sandals,Adidas,3299.0,40
Men's adidas Running SenseBoost GO Shoes,Adidas,11999.0,40
Men's adidas Running Solar Boost ST 19 Shoes,Adidas,15999.0,40
Men's adidas Originals Skateboarding Seeley Shoes,Adidas,6999.0,50
men's ADIDAS RUNNING TYLO SHOES,Adidas,5599.0,60
Men's adidas Sport Inspired Lite Racer Slip-Ons,Adidas,3999.0,50
Men's adidas RUNNING COSMIC 2 SHOES,Adidas,6999.0,50
Men's adidas Running Galaxy 4 Shoes,Adidas,5299.0,50
Men's adidas Sport Inspired Lite Racer CLN Shoes,Adidas,4999.0,40
Men's adidas Football Predator 19+ Firm Ground Cleats,Adidas,22999.0,40
Men's adidas Sport Inspired Astro Lite 2.0 Shoes,Adidas,3799.0,50
Men's adidas Sport Inspired Quickspike Shoes,Adidas,3999.0,50
Men's adidas Running Stunn Shoes,Adidas,5599.0,50
Men's adidas Running Kivaro 1 Shoes,Adidas,4599.0,50
Men's adidas Originals Campus Shoes,Adidas,7999.0,50
Men's adidas Running Stargon 1.0 Shoes,Adidas,4299.0,50
Men's adidas Outdoor Hoist Light Sandals,Adidas,2999.0,40
Men's Running Duramo SL Shoes,Adidas,5999.0,0
Men's adidas Outdoor Fassar Sandals,Adidas,2799.0,40
Men's adidas Sports Inspired Lite Racer Shoes,Adidas,3999.0,40
Men's adidas Originals Yung-96 Chasm Shoes,Adidas,7999.0,40
Men's adidas RunFalcon Shoes,Adidas,5999.0,0
Men's Running Duramo SL Shoes,Adidas,5999.0,0
Men's adidas Running Asweerun Shoes,Adidas,5599.0,0
WOMEN'S ADIDAS ORIGINALS SUPERSTAR SLIP-ON SHOES,Adidas,5999.0,50
WOMEN'S ADIDAS RUNNING NEPTON 2.0 SHOES,Adidas,4999.0,50
MEN'S ADIDAS SPORT INSPIRED LITE RACER SHOES,Adidas,3999.0,40
WOMEN'S ADIDAS RUNNING ENERGY CLOUD V SHOES,Adidas,5999.0,50
Men's adidas Running PureBoost Shoes,Adidas,12999.0,50
MEN'S ADIDAS RUNNING DURAMO 9 SHOES,Adidas,5999.0,0
Men's adidas Running Duramo 9 Shoes,Adidas,6599.0,50
MEN'S ADIDAS SPORT INSPIRED VIDELL SHOES,Adidas,3799.0,50
Women's adidas Originals Swift Run Shoes,Adidas,7999.0,50
WOMEN'S ADIDAS ORIGINALS SAMBA OG SHOES,Adidas,7999.0,50
MEN'S ADIDAS RUNFALCON SHOES,Adidas,5999.0,0
WOMEN'S ADIDAS ORIGINALS POD-S3.1 SHOES,Adidas,12999.0,50
WOMEN'S ADIDAS ORIGINALS SAMBA OG SHOES,Adidas,7999.0,50
Women's adidas Sport Inspired Quesa Shoes,Adidas,6999.0,50
Men's adidas Running EnergyFalcon Shoes,Adidas,6999.0,0
Men's adidas Sport Inspired Lite Racer RBN Shoes,Adidas,5599.0,0
Men's adidas Running EnergyFalcon Shoes,Adidas,6999.0,0
Men's adidas Running EnergyFalcon Shoes,Adidas,7599.0,0
Women's adidas Originals Gazelle Shoes,Adidas,7999.0,50
Men's adidas Sport Inspired Lite Racer CLN Shoes,Adidas,4999.0,0
Women's adidas Originals U_Path Run Shoes,Adidas,7999.0,50
Women's adidas Outdoor Mode Sandals ,Adidas,2499.0,40
Women's adidas Originals Supercourt RX Shoes,Adidas,12999.0,0
Women's adidas  SWIM BRIZO 4.0 Slippers,Adidas,1499.0,60
Men's adidas Sport Inspired Fusion Flow Shoes,Adidas,5999.0,50
Men's adidas Running Kalus Shoes,Adidas,4299.0,50
Men's adidas Sport Inspired Archivo Shoes,Adidas,5599.0,0
Men's adidas Sport Inspired Archivo Shoes,Adidas,5599.0,0
Men's adidas Running Asweego Shoes,Adidas,7999.0,0
Women's adidas Originals Marathon Tech Shoes,Adidas,11999.0,40
Unisex adidas Originals Superstar Shoes,Adidas,10999.0,0
Unisex Originals Stan Smith Shoes,Adidas,10999.0,0
Women's adidas Originals U_Path X Shoes,Adidas,7599.0,40
Women's adidas Originals Gazelle Shoes,Adidas,7999.0,40
Men's Sport Inspired Run60s Shoes,Adidas,5599.0,0
Men's Sport Inspired Run60s Shoes,Adidas,5599.0,0
Women's adidas Originals POD-S3.1 Shoes,Adidas,11999.0,40
Unisex adidas Originals Skateboarding 3MC Shoes,Adidas,5999.0,50
Unisex adidas Originals Sabalo Shoes,Adidas,7599.0,50
WOMEN'S ADIDAS SPORT INSPIRED QT SHOES,Adidas,3999.0,0
Women's adidas Originals Swift Run Shoes,Adidas,7599.0,40
Women's ADIDAS RUNNING EDGE LUX SHOES,Adidas,7599.0,50
Unisex adidas Originals Skateboarding 3MC Shoes,Adidas,5999.0,50
WOMEN'S ADIDAS SPORT INSPIRED COURT ADAPT SHOES,Adidas,5299.0,50
Women's adidas Sport Inspired Advantage Shoes,Adidas,5599.0,50
Women's adidas Sport Inspired Grand Court Shoes,Adidas,5299.0,50
Women's adidas Sport Inspired Cloudfoam Racer TR Shoes,Adidas,5599.0,50
WOMEN'S ADIDAS ADVANTAGE CL QT SHOES,Adidas,4599.0,50
Women's adidas Sport Inspired Questar Ride Shoes,Adidas,6599.0,50
WOMEN'S ADIDAS RUNNING EDGE LUX 2 SHOES,Adidas,7999.0,50
Women's adidas Sport Inspired VS Advantage Clean Shoes,Adidas,4599.0,50
WOMEN'S ADIDAS SPORT INSPIRED RUN 70S SHOES,Adidas,6599.0,50
Women's adidas Running Edge Lux Clima 2 Shoes,Adidas,7999.0,50
WOMEN'S ADIDAS RUNNING EDGE LUX 3 SHOES,Adidas,7999.0,50
Women's adidas Sport Inspired Lite Racer Reborn Shoes,Adidas,5599.0,50
WOMEN'S ADIDAS SPORT INSPIRED QUESTAR FLOW SHOES,Adidas,5999.0,50
Women's adidas Sport Inspired Energy Cloud V Shoes,Adidas,5999.0,50
Women's adidas Sport Inspired Grand Court Base Shoes,Adidas,3999.0,0
Women's Sport Inspired Advantage Base Shoes,Adidas,4599.0,0
Women's adidas Running Edge Lux 3 Shoes,Adidas,7999.0,50
Women's adidas Running Asweego Shoes,Adidas,6999.0,50
Women's Sport Inspired Grand Court Shoes,Adidas,5999.0,0
Women's adidas Originals Fiorucci Falcon Shoes,Adidas,11999.0,50
Women's Sport Inspired Advantage Shoes,Adidas,5599.0,0
Women's adidas Sport Inspired Advantage Base Shoes,Adidas,4599.0,0
Women's Sport Inspired Coneo QT Shoes,Adidas,3999.0,0
Women's Sport Inspired Courtflash X Shoes,Adidas,4599.0,0
Women's adidas Originals Adilette Slides,Adidas,3599.0,0
Women's Sport Inspired Courtflash X Shoes,Adidas,3999.0,0
Women's Sport Inspired Courtflash X Shoes,Adidas,3999.0,0
Women's Sport Inspired Courtflash X Shoes,Adidas,3999.0,0
Women's adidas Originals Adilette Slides,Adidas,3599.0,0
Women's adidas Sport Inspired Courtflash X Shoes,Adidas,3999.0,0
Women's adidas Originals Nite Jogger Shoes,Adidas,12999.0,40
Women's adidas Originals Falcon Shoes,Adidas,7999.0,40
Women's adidas Originals NMD_R1 Shoes,Adidas,12999.0,40
Men's Sport Inspired Archivo Shoes,Adidas,5599.0,0
Women's adidas Originals Stan Smith Shoes,Adidas,7999.0,40
Unisex adidas Swim Adilette TND Slides,Adidas,2999.0,0
Men's Sport Inspired Nebzed Shoes,Adidas,5599.0,0
Men's Sport Inspired Archivo Shoes,Adidas,5599.0,0
Men's Sport Inspired Nebzed Shoes,Adidas,5599.0,0
Men's adidas Running Asweerun Shoes,Adidas,5599.0,0
Men's Sport Inspired Nebzed Shoes,Adidas,5599.0,0
Men's Sport Inspired Nebzed Shoes,Adidas,5599.0,0
Women's adidas Swim Eezay Slippers,Adidas,1299.0,50
Women's ADIDAS SWIM BRIZO 4.0 SLIDES ,Adidas,1499.0,50
Women's adidas Swim Eezay Flip-Flops,Adidas,1999.0,50
Men's Running FluidFlow Shoes,Adidas,7999.0,0
Men's Running Nova Flow Shoes ,Adidas,5999.0,0
Women's adidas Swim Eezay Slippers,Adidas,1299.0,50
Men's Sport Inspired Phosphere Shoes,Adidas,6999.0,0
WOMEN'S ADIDAS SWIM EEZAY DOTS FLIP-FLOPS,Adidas,1999.0,50
WOMEN'S ADIDAS ORIGINALS FALCON SHOES,Adidas,7999.0,0
Men's adidas Sports Inspired Lite Racer 2.0 Shoes,Adidas,4599.0,0
Men's Running Nova Flow Shoes ,Adidas,5999.0,0
UNISEX ADIDAS ORIGINALS SKATEBOARDING 3MC SHOES,Adidas,5999.0,40
